keyword,title,description,link,nouns
서울러닝,815런 2024 서울 러닝 행사 일정 코스 기념품 정보 총정리,"서울 러닝 행사인 815런 2024를 소개해 드리려 합니다. 즐거운 러닝도 하고 기부도 함께 하는 815런, 815런 행사 정보와 기념품 정보, 코스 추천까지 총정리해서 살펴 보도록 하겠습니다. 815런 2024 서울... ",https://blog.naver.com/my_life_moment/223516374072,"행사,일정,기념품,정보,정리,행사,소개,기부,행사,정보,기념품,정보,정리,산소,블로그,네이버,블로그"
서울러닝,페더 서울 러닝 양말 초경량 컴포트 양말 형광 포인트 신어본... ,▽ '페더 서울 러닝 양말' 둘러보러가기! https://brand.naver.com/comport/products/6172621291 #러닝양말 #컴포트양말 #페더서울 #운동양말 #마라톤양말 #기능성양말 #러닝용품 #발편한양말 #아치서포트 #스포츠양말,https://blog.naver.com/yzk12272/224218312261,"페더,양말,경량,포트,양말,형광,포인트,신어,페더,양말,유명성,네이버,블로그"
서울러닝,서울 러닝 코스 장소 5km 달리기 옥수나들목 가는 법 짐 보관 팁,달리면서 한강의 야경을 함께 보며 달리는데 ‘아… 이게 바로 서울 사는 재미구나’ 싶더라고요. 특히 잠수교는 서울 러닝 코스 명소로도 유명해서 많은 러닝 크루들이 인증샷을 남기는 스팟이에요. 출처... ,https://blog.naver.com/sinnyarea/224059427977,"장소,옥수,나들목,보관,한강,야경,바로,재미,구나,잠수교,명소,크루,인증샷,스팟,출처,사계절,아웃도어,안내서,네이버,블로그"
서울러닝,서울 마라톤대회 총정리 밤섬런 여의도 한강공원 러닝,메달 #서울마라톤 #서울러닝대회 #서울마라톤대회 #서울러닝 #러닝대회 #마라톤대회 #마라톤가격 #마라톤후기 #밤섬런시간 #밤섬런접수 #밤섬런기념품 #밤섬런가격 #밤섬런모임장소 #밤섬런출발... ,https://blog.naver.com/choismong/224249511942,"대회,정리,밤섬,여의도,한강,메달,기록,기억,네이버,블로그"
서울러닝,2026년 4월 3주차 서울 마라톤 대회 총정리! (+러닝 코스 주말... ,✨ #마라톤대회 #2026년마라톤 #4월마라톤 #서울마라톤일정 #러닝 #주말러닝 #자전거도로안전 #한강러닝 #키움런 #마포서윤복마라톤 #동작구청장배마라톤 #k건강마라톤 #서울트레일런 #스카이런 #오운완... ,https://blog.naver.com/yeepi01/224253190896,"주차,대회,정리,주말,스노보드,자덕,네이버,블로그"
서울러닝,2026 서울 팀 k리그 런 마라톤 일정 접수 10km 러닝,서울러닝대회 #10km러닝대회 #마라톤대회 #상암평화의공원 #K리그팬이벤트 #러닝대회정보 #서울마라톤 #러닝이벤트 #K리그팬러닝 #서울러닝 #10km마라톤 #러닝대회추천 #서울마라톤일정 #마라톤 #러닝,https://blog.naver.com/qhadldhaus98/224201031528,"리그,일정,접수,대회,골프,여행가,축구,보미,네이버,블로그"
서울러닝,서울러닝엑스포 2026 일정 및 참가 업체 이벤트 총정리,#서울러닝엑스포 #서울마라톤 #서울마라톤엑스포 #DDP행사 #러닝엑스포 #러닝이벤트 #러닝박람회 #마라톤대회 #러닝문화 #러닝커뮤니티 #러닝장비 #러닝정보 #서울러닝이벤트 #마라톤준비,https://blog.naver.com/realpsg/224214702865,"엑스포,일정,참가,업체,이벤트,정리,트렌드,네이버,블로그"
서울러닝,"양재천 벚꽃 러닝 후기, 서울 봄 산책 러닝코스 여기 하나면 끝!",#양재천러닝 #양재천벚꽃 #서울러닝코스 #벚꽃러닝 #서울벚꽃명소 #러닝코스추천 #서울달리기 #봄러닝 #러닝일상 #런스타그램 #러닝기록 #서울운동 #야외운동 #러닝스타그램 #벚꽃명소 #서울산책코스 #운동기록... ,https://blog.naver.com/minsanity-/224241559588,"양재천,벚꽃,후기,산책,여기,하나,서약,네이버,블로그"
서울러닝,러닝 대회때 착용할 러닝 양말을 찾으신다면 컴포트 페더 서울,컴포트 페더 서울 #러닝양말 #컴포트양말 #운동양말 #페더서울 #보호양말 #러닝크루양말 겨울 동안 날씨가 너무 추워서 러닝을 한동안 쉬고 있었어요. 그러다 날이 조금씩 풀리기 시작하면서 다시 몸을 움직이고... ,https://blog.naver.com/japchodh/224216907071,"대회,착용,양말,포트,페더,포트,페더,겨울,동안,시작,다시,움직,주관,블로그,네이버,블로그"
서울러닝,"JTBC 서울 마라톤, 러닝 매니아들은 왜 '제마'에 열광할까?... ","JTBC 서울 마라톤, 러닝 매니아들은 왜 '제마'에 열광할까? 10년차 러너가 정리해본 JTBC 마라톤만의 차별성 5가지 추첨이 되어야만 참가할 수 있는 마라톤? 뭐가 다르길래 뛰는데 굳이 당첨까지 되야해? 지난 주... ",https://blog.naver.com/trlove0205/224253670457,"매니아,매니아,러너,정리,차별성,가지,추첨,참가,굳이,당첨,덕업,주의,긍정,스토리,네이버,블로그"
서울러닝,"서울 러닝코스 추천 (서울숲, 뚝섬한강, 반포 등)",다음주는 속초룰 달려볼게요! 공감/댓글은 컨텐츠 제작에 힘이 됩니다. 감사해요 #서울러닝코스 #남산러닝코스 #반포러닝 #한강러닝 #서울숲러닝 #서울숲한강 #붕어빵런,https://blog.naver.com/yellownoda/223981802252,"서울숲,뚝섬,한강,반포,다음주,속초,공감,댓글,컨텐츠,제작,네이버,블로그"
서울러닝,서울 경복궁 &amp; 광화문 러닝 코스 - 카멜커피 서촌점 &amp; 온 유어 마크,그럼 모두들 즐거운 주말 보내시고 행복한 하루 보내세요:) #경복궁러닝 #광화문러닝 #서울러닝 #카멜커피서촌 #온유어마크 #러닝편집샵 #경복궁영추분 #서울종로러닝 #시티런,https://blog.naver.com/bigway22/224016459945,"경복궁,광화문,카멜,커피,촌점,마크,모두,주말,하루,모리,여행,네이버,블로그"
서울러닝,더현대 서울 러닝 성지 TRC Seoul 러닝클럽 편집샵,요즘 짝꿍이 러닝에 제대로 빠져버려서 함께 더현대 서울을 갔다가 러너들 사이에서 핫하다는 TRC Seoul을 직접 다녀왔습니다 오늘 글에서는 더현대 서울 러닝 성지로 불리는 공간이 왜 그렇게 주목받는지 그리고... ,https://blog.naver.com/gpwl98/224232280133,"현대,성지,클럽,편집,요즘,짝꿍,제대로,현대,러너,사이,직접,현대,성지,공간,주목,웰니스,노트,네이버,블로그"
서울러닝,"서울 출장 중 만난 도심 속 오아시스, 경의선 숲길 아침 러닝 6k",#경의선숲길 #서울러닝코스 #서울출장 #서울가든호텔 #경의선광장 #서강대역 #홍대입구역 #공항철도 #모닝러닝 #오런완 #오운완 #러닝기록 #런스타그램 #씬장군 #행복러너 #서울조깅 #도심러닝... ,https://blog.naver.com/geolsb/224252256098,"출장,만난,도심,오아시스,경의선,숲길,씬장군,대한민국,보기,네이버,블로그"
서울러닝,"3월에만 19개, 서울 마라톤 과열 논란 러닝 열풍의 그림자... ",#서울마라톤 #러닝열풍 #마라톤대회 #서울교통통제 #러닝문화 #도심마라톤 #서울러닝 #마라톤논란 #러닝인구증가 #생활스포츠 사진출처 - &quot;주말마다 차 막혀요&quot; 도심 한복판 마라톤에 불편 호소하는 시민들 / 14F... ,https://blog.naver.com/times_minton/224235284484,"과열,논란,열풍,그림자,사진,출처,주말,도심,복판,불편,호소,시민,네이버,블로그"
서울러닝,2026 서울러닝엑스포! 동마 서울마라톤 참가라면 꼭 가야할... ,"2026 서울 러닝 엑스포 소식 가져왔어요. 입장료나 사전 예약 없이 무료로 입장 가능한데요. 서울마라톤 굿즈부터 아디다스, 샥즈 등 다양한 러닝 브랜드가 참가해 볼거리도 많고 러너들에게는 특히... ",https://blog.naver.com/hhyejjin0810/224212800870,"엑스포,참가,라면,가야,엑스포,소식,입장료,사전,예약,무료,입장,부터,아디다스,샥즈,브랜드,참가,볼거리,러너,패션,네이버"
서울러닝,"7979 서울러닝크루 - 여의도, 청계천, 반포 7979SRC","새해 운동계획으로, 심폐지구력 높이는 러닝을 생각하고 계시다면, 무료로 하는 서울시 러닝크루인 7979 서울러닝크루 고려해 보시기 바래요! 인스타 @7979_src 를 팔로우 해 두시고, 3-4월쯤 시작한다는 공지... ",https://blog.naver.com/ipalm/224129166984,"크루,여의도,청계천,반포,새해,계획,폐지,구력,무료,서울시,크루,크루,고려,인스타,팔로우,두시,공지,네이버,블로그"
서울러닝,서울 마포구 상암 하늘공원·노을공원 추천 러닝 코스 후기,두 곳은 마포 주민뿐 아니라 러너들 사이에서도 이미 유명한 서울 대표 러닝 성지라서 꼭 한번 뛰어보고... 싶네요 ^^ #상암러닝 #하늘공원러닝 #노을공원러닝 #상암러닝코스 #서울러닝코스 #마포러닝 #러닝성지... ,https://blog.naver.com/yeepi01/224077996644,"마포구,상암,하늘,노을,후기,마포,주민,러너,사이,대표,성지,한번,보고,스노보드,자덕,네이버,블로그"
서울러닝,서울 K 마라톤 대회 일정 러닝 코스 하프마라톤 10km 달리기,#서울K마라톤 #서울마라톤 #마라톤대회 #러닝대회 #하프마라톤 #10km러닝 #광화문마라톤 #서울러닝 #러닝코스 #마라톤일정 #러닝정보 #국내마라톤 #서울마라톤일정,https://blog.naver.com/qhadldhaus98/224222913307,"대회,일정,하프마라톤,골프,여행가,축구,보미,네이버,블로그"
서울러닝,서울 러닝코스 추천 3.5km 자전거없는 남산둘레길 가는법,"길, 서울 런닝하기 좋은 곳 등 다양하게 즐길 수 있는 서울 러닝코스 추천 장소 소개해 봅니다. 서울 러닝코스 추천으로 꼽는 우선순위가 있으세요? 러닝코스 거리 5km, 10km 등, 러닝할때 뷰?, 한강? 무엇보다... ",https://blog.naver.com/oisuloi/224045210314,"자전거,남산,둘레길,런닝,장소,소개,꼽는,우선,순위,한강,무엇,네이버,블로그"
서울러닝,포켓몬 런 2026 서울 마라톤 일정 러닝 이벤트,포켓몬 런 2026 서울 마라톤 일정 러닝 이벤트 포켓몬 런 2026 in Seoul이 2026년 5월 5일 어린이날 서울... #포켓몬런 #포켓몬런2026 #포켓몬30주년 #서울러닝이벤트 #뚝섬한강공원 #어린이날행사 #한강러닝... ,https://blog.naver.com/qhadldhaus98/224182059981,"포켓몬,일정,이벤트,포켓몬,일정,이벤트,포켓몬,어린이날,골프,여행가,축구,보미,네이버,블로그"
서울러닝,2026 서울 마라톤 일정 러닝 코스 기념품 셔틀버스 총정리... ,서울 마라톤 러닝 코스 풀코스 청계천 동대문 성수 어린이대공원 잠실 이 구간들을 지나 마지막은 잠실종합운동장에서 마무리됩니다. 서울 중심부에서 동쪽으로 이어지는 코스입니다. 도심 풍경을 보며... ,https://blog.naver.com/qhadldhaus98/224207019901,"일정,기념품,셔틀버스,정리,청계천,동대문,성수,어린이,잠실,지나,마지막,잠실,종합,운동장,마무리,중심부,동쪽,도심,풍경,골프"
서울러닝,제11회 서울트레일런 대회 접수 일정 코스 [산악 트레일러닝],거리가 길어질수록 난이도는 가볍지 않습니다. 준비 단단히 하고 출발하시기 바랍니다. #서울트레일런 #서울트레일러닝 #산악트레일 #109km #50km #북한산트레일 #트레일러닝 #서울트레일런대회,https://blog.naver.com/qhadldhaus98/224180830003,"트레일,대회,접수,일정,산악,트레일,난이도,준비,출발,골프,여행가,축구,보미,네이버,블로그"
서울러닝,여의도 더현대서울 러닝 팝업 TRC SEOUL 오픈｜뉴마핏 러닝... ,마세요  #더현대서울 #더현대서울팝업 #여의도더현대 #TRC서울 #러닝클럽서울 #러닝팝업 #뉴마핏러닝진단 #러닝체험 #서울팝업추천 #더현대팝업 #여의도가볼만한곳 #서울데이트코스 #러닝화추천 #가민... ,https://blog.naver.com/jtypelove/224222358097,"여의도,현대,팝업,오픈,뉴마,네이버,블로그"
서울러닝,러닝 전문 박람회! 서울마라톤이 준비한 &lt;2026 서울러닝엑... ,"다양한 러닝 브랜드와 장비, 러닝 커뮤니티를 한자리에서 만나볼 수 있는 행사입니다. 서울마라톤의 공식 엑스포라니, 더 기대가 됩니다. 서울러닝엑스포 2026 SEOUL RUNNING EXPO 장소... ",https://blog.naver.com/opencareblog/224211562762,"전문,박람회,준비,브랜드,장비,커뮤니티,한자리,나볼,행사,공식,엑스포,기대,엑스포,장소,오픈,케어,철인,모든,네이버,블로그"
서울러닝,벚꽃 터널 아래를 달리다♂️ 서울 벚꽃 러닝 명소 &amp; 2026... ,#2026벚꽃 #벚꽃개화시기 #서울벚꽃명소 #벚꽃축제 #벚꽃만개시기 #전국벚꽃지도 #봄나들이 #꽃구경#벚꽃엔딩 #벚꽃러닝 #러닝명소 #서울러닝코스 #런린이 #러너 #여의도벚꽃 #석촌호수벚꽃 #서울숲... ,https://blog.naver.com/dudgmlqo/224214307928,"벚꽃,터널,아래,달리,벚꽃,명소,벚꽃,엔딩,아빠,네이버,블로그"
서울러닝,러너들의 루프밴드 하체운동ㅣ2026 서울마라톤 공식 러닝... ,세라밴드 루프밴드로 완성하는 하체 운동 밸런스 루틴 잠스트 2026 서울마라톤 공식 서울 러닝 클래스 FULL반 세션에서 진행된 SSL KOREA 정다움 코치님의 특별한 러닝 훈련 트레이닝 현장을 공유합니다! 이번... ,https://blog.naver.com/naum7575/224206785602,"러너,루프,밴드,하체,공식,세라,밴드,루프,밴드,완성,하체,밸런스,루틴,잠스트,공식,클래스,세션,진행,코치,트레이닝"
서울러닝,러닝화 브랜드 써코니 더메이즈 서울 러닝 이벤트 후기,"저도 기회가 된다면 경험해보고 싶은 러닝화에요. 써코니 더메이즈 서울은 공정하게 진행되는 스위스 방식으로 진행되는 릴레이 레이스 경기였어요. 스위스 방식은 토너먼트와 다른 개념으로, 비교적 적은... ",https://blog.naver.com/allaboutcanada/224025681174,"브랜드,메이즈,이벤트,후기,기회,경험,메이즈,진행,스위스,방식,진행,릴레이,레이스,경기,스위스,방식,토너먼트,다른,개념,비교"
서울러닝,서울 러닝코스 댕댕런 강아지런 코스 지도 gpx 8.7km 완주,"함께 서울 러닝코스 강아지런 코스 지도를 따라서 산책을 하고 왔어요! 저는 아래와 같은 댕댕이 모양으로 산책했고, 총 거리는 8.8km, 시간은 2시간 22분 걸렸어요. 강아지런 코스 시간으로 러닝을 감안하자면... ",https://blog.naver.com/goldendaebak/224134628217,"댕댕,강아지,지도,완주,강아지,지도,따라서,산책,아래,댕댕,모양,산책,강아지,감안,네이버,블로그"
서울러닝,서울 러너라면 필독!... 무료 샤워장 등 러닝 정보 모음.zip,"서울 러닝 행사, 러닝 인프라, 러너 편의시설 정보를 한눈에 정리했습니다. 러닝이 하나의 라이프스타일로 자리 잡으면서 서울 곳곳에서도 달리기를 즐기는 시민들이 늘고 있습니다. 서울에서는 이런 흐름에... ",https://blog.naver.com/haechiseoul/224214018654,"러너,라면,필독,무료,샤워,정보,모음,행사,인프라,러너,편의,시설,정보,한눈,정리,하나,라이프스타일,자리,곳곳,시민"
서울러닝,서울 러닝 코스 올림픽공원 러닝 &amp; 단풍 -빵집 추천... ,서울 러닝 코스 올림픽공원 러닝 &amp; 단풍 르봉마리아쥬 베이커리! 안녕하세요. 모리입니다. 오늘은 서울... 르봉마리아쥬 서울 송파구 올림픽로 417 1층 올림픽 회관 맞은편 쪽에 위치하고 있습니다. 매일 오전... ,https://blog.naver.com/bigway22/224084412055,"올림픽,단풍,빵집,올림픽,단풍,르봉,마리아,베이커리,모리,르봉,마리아,송파구,올림픽로,올림픽,회관,맞은편,위치,매일,오전,모리"
서울러닝,"러닝 후기, 도심 속 호수뷰 서울 달리기 명소 러닝코스 추천",#석촌호수 #석촌호수러닝 #석촌호수코스 #서울러닝코스 #잠실러닝 #서울달리기 #러닝코스추천 #서울러너 #호수뷰러닝 #도심러닝 **종아리 압박 회복에 최고! 러닝용품 추천,https://blog.naver.com/yeepi01/223999691424,"후기,도심,호수,명소,종아리,압박,회복,최고,용품,스노보드,자덕,네이버,블로그"
서울러닝,매주 목요일 함께 달려요! 7979 서울 러닝크루,(수) - 매월 첫째주 월요일 사전 신청 오픈 - 동마클럽 및 서울시 공공서비스예약에서 신청 가능 - 놓쳤다면? 현장 접수도 OK ◆ 러닝코스 [러닝 집결지 중 선택 1] - 초급자 / 광화문권역 - 중급자... ,https://blog.naver.com/seoulsportal/224239311408,"목요일,크루,매월,월요일,사전,신청,오픈,클럽,서울시,서비스,예약,신청,가능,현장,접수,집결,선택,광화문,서울특별시,체육회"
서울러닝,서울 벚꽃런 몽마르뜨공원 러닝 코스,없이 마라톤을 할 수 있음 관심 있는 분들은 뛰뛰ㄱㄱㄱ  기간: 3월 21일 ~ 4월 30일  참가비: 3만원  코스: 4.5km / 9.5km 선택 가능 #서울벚꽃 #벚꽃러닝 #서리풀공원 #몽마르뜨공원 #벚꽃런 #서울러닝코스 #랭킹마라톤,https://blog.naver.com/ddmjk/224256284744,"벚꽃,몽마,르뜨,관심,기간,참가,선택,가능,재미,네이버,블로그"
서울러닝,할 서울 러너들 주목! ➡️ 다시 돌아온 '서울 러닝순찰대... ,"운동하면서 봉사도 할 수 있는 의미 있는 활동, 서울 러닝순찰대란? 서울시 자치경찰위원회에서는 러닝을 하며 동네 안전을 함께 살피는 ‘서울 러닝순찰대’를 운영합니다. 올해는 참여 기회를 넓혀 10개... ",https://blog.naver.com/haechiseoul/224236781904,"러너,주목,다시,순찰,봉사,의미,활동,순찰,대란,서울시,자치,경찰,위원회,동네,안전,순찰,운영,올해,참여,기회"
서울러닝,매주 목요일 7979 서울 러닝크루와 함께 달려요~,"바로가기 △ 서울시 공공서비스 예약 바로가기 이해를 돕기 위한 예시 이미지 7979 서울 러닝크루는 수준별 러닝 코스를 운영 중이라, 러닝 초보부터 고수까지 모두 다 즐길 수 있어요!  게다가 중·상급... ",https://blog.naver.com/hot2hot2seoul/224238495579,"목요일,크루,바로가기,서울시,서비스,예약,바로가기,이해,돕기,예시,이미지,크루,수준별,운영,중이,초보,고수,모두,게다가,상급"
서울러닝,뉴발란스 x 기안84 Run &amp; Party 서울 마라톤 일정 &amp; 러닝... ,숨이 턱 끝까지 차오르는 그 살아있는 감각을 즐겁게 만끽해 보시길 바랍니다. #RunYourWay #뉴발란스마라톤 #런앤파티 #러닝 #서울마라톤일정 #마라톤 #뉴발란스성수 #성수팝업 #뉴발란스이벤트,https://blog.naver.com/qhadldhaus98/224249549157,"뉴발란스,기안,일정,감각,만끽,골프,여행가,축구,보미,네이버,블로그"
서울러닝,러닝크루 주목! 제이엘브 이벤트 서울 러닝코스 정보,"그런데 이번에는 대표적인 서울 러닝코스를 완주하면서, 동시에 특별한 선물까지 받을 수 있는... 달리기를 즐기는 러닝크루 여러분, 이번 제이엘브 행사를 통해 서울 속 러닝 여정을 기록하고, 땀과... ",https://blog.naver.com/nicenet/224023619006,"크루,주목,제이,이벤트,정보,대표,완주,동시,선물,크루,여러분,제이,행사,통해,여정,기록,근육,요정,알프,네이버"
서울러닝,더현대 러닝 클럽 방문기 : TRC 서울,"식지않는 러닝 열풍에 더현대, 판 키웠다 -현대백화점, 더현대서울 러닝클럽 오픈 -측정부터 코칭까지 ... 체험형 플랫폼 구현 -여의도 러닝코스와 연계 ... 러닝성지 전략 더현대 서울 4층 Life&amp;Balance 전국에서... ",https://blog.naver.com/wonho6743/224237882134,"현대,클럽,방문,식지,열풍,현대,현대,백화점,현대,클럽,오픈,측정,코칭,체험,플랫폼,구현,여의도,성지,전략,현대"
서울러닝,2024 시즌마감 마라톤 대회 서울 마라톤 일정 러닝 코스 기념품,마라톤대회 #하프코스 #10km러닝 #5km러닝 #10km커플런 #완주메달 #러닝기념품 #러닝코스 #마라톤준비물 #러닝즐기기 #겨울마라톤 #서울러닝 #한강러닝 #러너들의축제 #팀워크러닝 #서울마라톤일정 #러닝 #마라톤,https://blog.naver.com/qhadldhaus98/223690438965,"시즌,마감,대회,일정,기념품,대회,골프,여행가,축구,보미,네이버,블로그"
서울러닝,포기할 수 없는 서울 러닝 명소 3곳과 안전 가이드 발목보호대... ,서울 겨울 러닝 추천 코스 BEST 3 그럼에도 불구하고 겨울 러닝을 포기할 수 없는 여러분을 위해 서울에서 겨울에도 안전하고 즐겁게 달릴 수 있는 코스 3곳을 엄선했습니다. 올림픽공원: 넓고 평탄한 코스로 초보... ,https://blog.naver.com/roh339/224142893226,"포기,명소,안전,가이드,발목,보호대,겨울,불구,겨울,포기,여러분,위해,겨울,엄선,올림픽,초보,기초,영어,회화,실력"
서울러닝,서울마라톤 주간 BTGSEL 2026 러닝 커뮤니티 이벤트 일정,"이 행사는 단순한 러닝 이벤트가 아니라 서울 러닝 커뮤니티가 함께 만드는 마라톤 주간 프로그램이다. 서울에서 활동하는 러닝 크루인 Seoul Venus, PRRC, Eighty Eight Seoul, 그리고 Nike... ",https://blog.naver.com/realpsg/224214729591,"주간,커뮤니티,이벤트,일정,행사,이벤트,커뮤니티,주간,프로그램,활동,크루,트렌드,네이버,블로그"
서울러닝,구로 올레길 트레일러닝 :: 서울 벚꽃 러닝명소  / 서울 둘레길... ,재밌게 잘 훈련했습니다  #구로올레길 #구로둘레길 #구로올레길 #천왕산 #개웅산 #매봉산 #트레일러닝 #서울트레일러닝 #구로올레길트레일러닝 #트레일러닝훈련 #서울둘레길 #구로둘레길코스 #서울트레일러닝코스,https://blog.naver.com/chita000/224250307624,"구로,올레길,트레일,벚꽃,명소,둘레길,월세,세계,여행,네이버,블로그"
서울러닝,서울 러닝 코스 추천 북촌 런허브 러닝화 대여하고 댕댕런 안암... ,#북촌러닝 #댕댕런 #나혼자산다댕댕런 #서울러닝코스 #이색러닝코스 #뉴발란스런허브 #런허브북촌 #러닝화대여 #퓨어셀레벨v5 #북촌안암 #미슐랭돼지국밥 #굿러너컴퍼니 #굿러너컴퍼니북촌 #삼청동호떡,https://blog.naver.com/kirruazz/224231482511,"북촌,허브,대여,댕댕,안암,먹기,위해,여자,라이프,네이버,블로그"
서울러닝,"러닝 발목보호대 추천하는 이유, 서울마라톤 러닝 엑스포... ",풀려 뛸 때 불편하신 분 #러닝발목보호대 #서울마라톤러닝엑스포 #서울러닝엑스포 #러닝준비물 #발목보호대 #러닝이벤트 #잠스트 #필르미스타앵클#러닝보호대 #러닝 #마라톤 #마라톤발목보호대 #발목보호대추천,https://blog.naver.com/9994gh/224204741106,"발목,보호대,이유,엑스포,보호대,네이버,블로그"
서울러닝,서울 러닝클래스 내돈내산 수업 후기,"베가베리 서울 러닝프로그램을 알게 되었어요 2. 러닝과 영양을 연결하는 베가베리 그렇게 찾게 된 게... 철학 러닝 전후 섭취할 수 있는 제품 제공부터 체계적인 코칭 시스템, 커뮤니티 활동까지 서울에서... ",https://blog.naver.com/qnpfrhh3/223914286577,"클래스,수업,후기,베가,베리,프로그램,영양,베가,베리,철학,전후,섭취,제품,제공,체계,코칭,시스템,커뮤니티,활동,수애"
서울러닝,2026 서울러닝엑스포 SEOUL RUNNING EXPO,2026 서울마라톤 겸 제96회 동아마라톤 대회가 열리는 날입니다. 동아마라톤에 참가하는 해외... #서울러닝엑스포 #러닝엑스포 이제 본격적으로 서울러닝엑스포를 둘러보겠습니다~ 첫 번째 전시장에... ,https://blog.naver.com/supershim2/224216616591,"엑스포,동아마라톤,대회,동아마라톤,참가,해외,이제,본격,엑스포,전시장,네이버,블로그"
서울러닝,인스타 핫한 서울 러닝클럽 추천! 언노운 크루보다 더 핫한... ,"인스타에서 제일 핫한 서울 러닝 크루 글 @테니제로 이미지 @instagram 서울 러닝 크루 션을 주축으로... 서울 내에서 정기 러닝 클럽으로 활동하고 있지만, 러닝 프로그램 외에 룰루레몬, 언더아머 등 스포츠... ",https://blog.naver.com/hhyejjin0810/224081082492,"인스타,클럽,언노운,크루,인스타,제일,크루,제로,이미지,크루,주축,정기,클럽,활동,프로그램,룰루,레몬,스포츠,패션,네이버"
서울러닝,서울 러닝 15km 코스 송파둘레길+올림픽공원,안녕하십니까 원래 오늘 월간러닝이었는데 시간 약간 애매함 이슈+내가 630페이스 장거리 못 따라감 ㅠ... 분당쪽 이렇게 집값높은곳을 간접 러닝 임장(?) 자전거로 지나다니던 천호대교 앞. 라이더들도 많다!!... ,https://blog.naver.com/greeenworld/224257446643,"송파,둘레길,올림픽,안녕하십니까,원래,월간,약간,이슈,장거리,분당,집값,간접,자전거,천호대교,라이더,네이버,블로그"
