keyword,title,description,link,nouns
서울러닝코스,"서울 러닝코스 추천, 처음 시작하기 좋은 구간은 어디일까",이 점이 러닝을 꾸준히 이어가기 좋은 이유가 됩니다. 오늘은 서울 러닝코스 추천해드리도록... 서울에서 러닝코스로 자주 언급되는 장소는 어디일까 여의도 한강공원은 러닝 인구가 특히 많은 곳입니다. 평지... ,https://blog.naver.com/fing3rscompany/224122802761,"처음,시작,어디,이유,자주,언급,장소,어디,여의도,한강,인구,평지,핑거스,네이버,블로그"
서울러닝코스,접수 일정 참가비 기념품 서울 러닝 코스 10km 5k 달리기,2026 버킷런 마라톤 접수 일정 참가비 기념품 서울 러닝 코스 10km 5k 달리기 버킷런으로 계속... #2026버킷런 #버킷런 #한강러닝대회 #잠실한강공원 #서울러닝 #5km달리기 #10km달리기#러닝 #러닝대회정보... ,https://blog.naver.com/qhadldhaus98/224135966215,"접수,일정,참가,기념품,버킷,접수,일정,참가,기념품,버킷런,계속,골프,여행가,축구,보미,네이버,블로그"
서울러닝코스,서울 송파 러닝 코스 빵런! - 문정 플루엣 &amp; 룰루 베이글,서울 송파 러닝 코스 빵런! 플루엣 &amp; 룰루베이글 2025년 가장 열심히 했던거 중에 하나가 바로... #서울러닝 #송파러닝 #플루엣송파본점 #룰루베이글 #문정동베이커피 #송파빵집 #빵런 #서울러닝코스,https://blog.naver.com/bigway22/224131445215,"송파,빵런,문정,플루,룰루,베이글,송파,빵런,플루,룰루,베이글,가장,하나,바로,모리,여행,네이버,블로그"
서울러닝코스,2026 서울유아차런 훈련 고양시 러닝코스 성사체육공원 추천,1km 구간 중 초반 200m 및 후반 150m 그러니까 약 350m 구간이 업힐이며 나머지는 평지와 내리막으로 되어 훈련하기 딱 좋은 고양시 러닝코스이죠. 금번 2026 서울유아차런은 8km 러닝이 예정되어 있기에 비슷한... ,https://blog.naver.com/enterside/224225035937,"유아차,고양시,성사,체육,초반,후반,업힐,나머지,평지,내리막,고양시,금번,유아차,예정,아빠,네이버,블로그"
서울러닝코스,티켓팅 신청 예매 방법 서울 러닝 잉어킹 마라톤 코스,"오늘은 2026 포켓몬런 서울 일정과 티켓 예매 방법, 코스 정보를 한 번에 정리해볼게요. 포켓몬런 행사 정보 포켓몬런은 포켓몬 IP를 활용한 테마형 러닝 이벤트예요. 기록 경쟁 중심 마라톤이라기보다 캐릭터... ",https://blog.naver.com/jini4998/224202408668,"티켓팅,신청,예매,방법,잉어킹,포켓몬,일정,티켓,예매,방법,정보,정리,포켓몬,행사,정보,포켓몬,포켓몬,활용,테마,이벤트"
서울러닝코스,예방하는 회복 러닝? 서울 5km 벚꽃 러닝코스와 골반 밀기,회복 러닝을 하며 자세를 교정하기에 서울 내에서 이만한 연습실이 또 있을까 싶습니다. 다만... 운동화끈묶는법 #서울러닝코스 #벚꽃러닝코스 #성내천러닝 #올림픽공원러닝 #송파러닝 #2주챌린지... ,https://blog.naver.com/dee7781/224241958154,"예방,회복,벚꽃,골반,회복,자세,교정,이만,연습실,다만,화끈,블로그,네이버,블로그"
서울러닝코스,서울 초보 러닝 코스 추천 어린이대공원 붕어빵런 5KM 달리기,오늘 소개해 드릴 곳은 서울 러닝 코스 중 초보자들이 뛰기 좋은 '어린이대공원'을 소개해 드리려고 합니다! :) 완주하면 붕어빵 모양으로 뛸 수 있어서 '붕어빵런'으로도 유명해요! [서울 초보 러닝 코스... ,https://blog.naver.com/sinnyarea/224131004045,"초보,어린이,붕어빵,소개,드릴,초보자,어린이,소개,완주,붕어빵,모양,붕어빵,초보,사계절,아웃도어,안내서,네이버,블로그"
서울러닝코스,2026 포켓몬런 마라톤 신청 서울 러닝 코스 접수 예매 티켓팅... ,"2026 포켓몬런 마라톤 신청 서울 러닝 코스 접수 예매 티켓팅 방법 어린이날 행사 굿즈 참가상품 뚝섬... 테마 러닝 이벤트로, 서울 광진구 뚝섬 한강공원 수변무대(강변북로 139)에서 진행됩니다. 비경쟁... ",https://blog.naver.com/miha1023/224201547581,"포켓몬,신청,접수,예매,티켓팅,포켓몬,신청,접수,예매,티켓팅,방법,어린이날,행사,참가,상품,뚝섬,테마,이벤트,광진구,뚝섬"
서울러닝코스,서울 힐링 러닝 코스! 한양도성길 트레일 러닝 후기,서울 힐링 러닝 코스! 한양도성길 트레일 러닝 후기 서울 힐링 러닝 코스! 한양도성길 트레일 러닝 후기... 한양도성길은 단순히 서울 러닝 코스라고 생각하고 접근하면 생각보다 훨씬 힘들게 느껴질 수 있습니다.... ,https://blog.naver.com/sjsg0079/224257365254,"힐링,한양도성,트레일,후기,힐링,한양도성,트레일,후기,힐링,한양도성,트레일,후기,한양도성,접근,일상,여행,여행,네이버,블로그"
서울러닝코스,서울 러닝 코스 여의도 고구마런 후기,해결되는 서울 러닝 코스를 찾는 분들께 이번 여의도 고구마런 후기가 꽤 도움이 될 것 같아요. 이날은 여의나루역 러너스테이션에서 출발해서 여의도 한강공원 쪽으로 이어지는 약 8km 코스를 달렸습니다. 러닝... ,https://blog.naver.com/feed_pocket/224251023037,"여의도,고구마,후기,해결,여의도,고구마,후기,도움,여의나루역,러너,스테이션,출발,여의도,한강,피드,두루,주머니,네이버,블로그"
서울러닝코스,[서울 러닝 코스] 한강 러닝 코스 추천 | 당산역... ,요즘 주말 나의 낙 서울 러닝 명소 찾아다니기 지하철역이랑 바로 이어져서 한강 러닝 할 수 있는 코스가 있다길래 토요일 눈 뜨자마자 출바알 ✨ 당산역 4번 출구로 나오면 바로 한강공원 가는 길이... ,https://blog.naver.com/ju_hyun1031/224238803137,"한강,당산역,요즘,주말,명소,지하철역,바로,한강,토요일,바알,당산역,출구,바로,한강,길이,네이버,블로그"
서울러닝코스,서울 러닝코스 추천 (남산공원•위례호수공원 +포천산정호수),새로운 러닝코스 추천입니다 :-)/ 서울 • 서울 근교 러닝하기 좋은 곳  첫번째는 #남산둘레길 #남산 조금... 갑니당 ⬇️⬇️⬇️⬇️⬇️ #러닝코스 #서울러닝코스 #러닝코스추천 #서울러닝코스추천... ,https://blog.naver.com/dmsal217/224065126599,"남산,위례,호수,포천,산정호수,근교,조금,네이버,블로그"
서울러닝코스,[서울 러닝 코스 추천] 영상 5도~10도 러닝 옷차림 완벽... ,드린 서울의 예쁜 코스들 중 마음에 드는 곳을 골라 이번 주말 가볍게 5km부터 시작해 보는 건 어떨까요? 안전하고 즐거운 러닝 되시길 응원합니다! #영상5도러닝 #영상10도옷차림 #러닝복장추천 #서울러닝코스... ,https://blog.naver.com/yeepi01/224214350293,"영상,옷차림,완벽,마음,주말,부터,시작,응원,스노보드,자덕,네이버,블로그"
서울러닝코스,서울 러닝 코스 추천 및 후기(1),되겠습니다 러닝 코스 요약 #1. RM 숲에서 출발 우선 시작 장소는 잠실한강공원에 위치한 RM 숲입니다. 지하철 2호선을 타고 잠실새내역에서 하차한 뒤 6번 혹은 7번 출구로 나와서 약 800m 걸어가야 (직진)합니다.... ,https://blog.naver.com/seungjun-fanpage/224253393989,"후기,요약,출발,우선,시작,장소,잠실,한강,위치,지하철,호선,타고,잠실,하차,출구,직진,승준,블로그,네이버,블로그"
서울러닝코스,2026 서울 하프 마라톤 일정 러닝 코스 하프 10km 달리기,2026 서울 하프 마라톤 일정 러닝 코스 하프 10km 달리기 2026 서울하프마라톤은 4월 26일 서울 도심 일대에서 개최됩니다. 광화문광장에서 출발하여 여의도와 상암동을 잇는 이번 대회는 하프마라톤... ,https://blog.naver.com/qhadldhaus98/224258685947,"하프,일정,하프,하프,일정,하프,하프마라톤,도심,일대,개최,광화문,광장,출발,여의도,상암동,대회,하프마라톤,골프,여행가,축구"
서울러닝코스,서울 한강 러닝 코스 &amp;  한강버스 잠실선착장 테라로사 카페... ,서울 한강 러닝 코스 테라로사 카페 &amp; 한강공원 모래놀이터 요즘 러닝 하기 너무 좋은 계절인데요! 오늘은 서울 한강 러닝 코스와 러닝 후 가기 좋은 테라로사 카페 자세히 소개해 드릴게요:) 한강러닝 코스 1.... ,https://blog.naver.com/bigway22/224256698423,"한강,한강,버스,잠실,선착장,테라로사,카페,한강,테라로사,카페,한강,모래,놀이터,요즘,계절,한강,가기,테라로사,카페,소개"
서울러닝코스,"1/4 서울 러닝코스, 여의도공원 8km 러닝, 더현대서울 구경... ",13km 기록 확실히 러닝을 처음 시작했을때보다 빨라졌다. 초반에는 5분 페이스대로 달리기도 하고 전체적으로 6분 초반대로 가능한 상황 체력이 확실히 좋아졌어 :) 여의나루역에 나온김에 더현대서울 구경을... ,https://blog.naver.com/najilong5027/223715067902,"여의도,현대,구경,기록,처음,시작,초반,전체,초반,상황,체력,여의나루역,현대,구경,즐거움,여자,네이버,블로그"
서울러닝코스,일산 서울 한강 러닝 코스 27km lsd 러닝 코스 GPX첨부,마포에서 일산호공 서울에서 일산 LSD 러닝 코스 단톡방에도 물어보고 인터넷도 뒤져보고 조금의 정보는 있었지만 코스가 별로라거나 자세한 정보를 알 수 없어서 직접 달려봤습니다. 대략 가양대교에서... ,https://blog.naver.com/kaeback2/224109072674,"일산,한강,첨부,마포,일산,호공,일산,톡방,인터넷,보고,조금,정보,로라,거나,정보,직접,대략,가양대교,강트,퍼스"
서울러닝코스,7979 서울 러닝크루 모집 수준별 야간 러닝 코스 정보,"10월까지 매주 목요일 저녁에 운영되는 7979 서울 러닝크루가 진행됩니다. 광화문, 반포, 여의도 등 수준별 코스와 전문가의 코칭, 안전한 런티켓 캠페인 정보를 정리합니다. 바쁜 일상 속에서 건강을 챙기기란... ",https://blog.naver.com/dysnomia/224256209216,"크루,모집,수준별,야간,정보,목요일,운영,크루,진행,광화문,반포,여의도,수준별,전문가,코칭,티켓,캠페인,정보,정리,일상"
서울러닝코스,서울 5KM 달리기 러닝 코스 추천 어린이대공원 붕어빵런,서울 5km 달리기 러닝 코스 어린이대공원 붕어빵런 안녕하세요! 광진구 SNS 서포터즈 산시니입니다... 이색적인 서울 러닝 코스 꼭 코스를 고정하지 않고 귀여운 동물 친구들이 있는 동물원을 가로질러 뛰거나... ,https://blog.naver.com/sinnyarea/224199498633,"어린이,붕어빵,어린이,붕어빵,광진구,서포터즈,산시,이색,고정,동물,동물원,사계절,아웃도어,안내서,네이버,블로그"
서울러닝코스,성북천 산책로 서울 혼자여행 러닝코스 추천,"서울혼자여행이나 러닝코스, 산책할 곳을 찾고 계신다면 여기는 꼭 한 번 걸어보시길 추천드릴게요! 다음에도 또 다른 장소로 찾아올게요. 감사합니다 :) 도움이 되셨다면 팬 하기 눌러주세요 ♥️",https://blog.naver.com/who_u_who/223919691513,"성북천,산책로,여행,여행,산책,다음,다른,장소,도움,모리,네이버,블로그"
서울러닝코스,자연과 함께하는 서울 러닝코스 추천해요!,"탁 트인 하늘과 바람이 함께 해주는 이 출발 지점은 서울 러닝 코스 중에서도 손에 꼽고 싶을... 길이라 러닝 초보자도 속도내기 좋아요 • 흙길+자연+조용함+서울 시내 뷰+ 한강 → 이 조합, 대체 불가능 코스... ",https://blog.naver.com/prmapo77/223966897335,"자연,하늘,바람,출발,지점,길이,초보자,속도,내기,흙길,자연,시내,한강,조합,대체,불가능,마포,구청,공식,블로그"
서울러닝코스,시 무릎 통증&quot; 잡는 상체 이완법? 서울 5km 벚꽃 러닝코스 추천,특히 성내천에서 올림픽공원을 잇는 이 벚꽃 러닝코스는 서울 내에서 보기 드문 '고저 차가 적은... 상체이완 #러닝자세 #달리기자세 #운동화끈묶는법 #러닝화추천 #서울러닝코스 #벚꽃러닝코스 #성내천러닝... ,https://blog.naver.com/dee7781/224238913094,"무릎,통증,상체,이완,벚꽃,성내천,올림픽,벚꽃,보기,고저,상체,이완,블로그,네이버,블로그"
서울러닝코스,"양재천 벚꽃 러닝 후기, 서울 봄 산책 러닝코스 여기 하나면 끝!",#양재천러닝 #양재천벚꽃 #서울러닝코스 #벚꽃러닝 #서울벚꽃명소 #러닝코스추천 #서울달리기 #봄러닝 #러닝일상 #런스타그램 #러닝기록 #서울운동 #야외운동 #러닝스타그램 #벚꽃명소 #서울산책코스 #운동기록... ,https://blog.naver.com/minsanity-/224241559588,"양재천,벚꽃,후기,산책,여기,하나,서약,네이버,블로그"
서울러닝코스,서울 트레일러닝 코스 추천 BEST 7: 입문부터 서울트레일런... ,"서울 트레일러닝 코스 추천 BEST 7: 입문부터 서울트레일런 대회 준비까지 난이도별 완벽 정리! 산과 도심을 넘나들며 달리는 매력, 트레일러닝(Trail Running)의 계절이 돌아오고 있습니다. 단순히 평지를 달리는... ",https://blog.naver.com/ohayo11/224192536824,"트레일,입문,트레일,트레일,입문,트레일,대회,준비,난이도,완벽,정리,도심,매력,트레일,계절,평지,여행,어학,건강,행복"
서울러닝코스,2026년 4월 3주차 서울 마라톤 대회 총정리! (+러닝 코스 주말... ,"러닝, 라이딩하기 딱 좋은 따뜻한 봄날, 4월 셋째 주 주말을 뜨겁게 달굴 서울 지역 마라톤 및 러닝 대회 소식에 실전 러닝을 위한 코스별 자전거 도로(자도) 주의사항까지 꽉꽉 채워 정리해 왔어요!... ",https://blog.naver.com/yeepi01/224253190896,"주차,대회,정리,주말,라이딩,봄날,주말,지역,대회,소식,실전,자전거,도로,자도,주의,사항,정리,스노보드,자덕,네이버"
서울러닝코스,“서울 한복판에서 10K 트레일러닝?” 한양도성길 남산·낙산... ,https://naver.me/xIFvi2sH https://naver.me/xm0g4tka https://naver.me/Fdo6oPGk #한양도성길 #트레일러닝 #서울트레일러닝 #남산러닝 #낙산러닝 #서울러닝코스 #트레일러닝코스 #서울등산코스 #러너추천코스 #러닝기록,https://blog.naver.com/nan0709/224206572549,"복판,트레일,한양도성,남산,낙산,러니윤,비비드,라이프,네이버,블로그"
서울러닝코스,2026 더레이스 서울 21K... 하프마라톤 10km달리기 러닝 코스,2026 더레이스 서울 21k 마라톤 일정 추가접수 하프마라톤 10km 달리기 러닝 코스 서울 도심을 달리는 러닝 대회는 매년 경쟁이 치열합니다. 정규 접수가 마감된 뒤 취소 및 환불로 발생한 잔여 좌석을... ,https://blog.naver.com/qhadldhaus98/224199727829,"레이스,하프마라톤,레이스,일정,추가,접수,하프마라톤,도심,대회,매년,경쟁,정규,접수,마감,취소,환불,발생,좌석,골프,여행가"
서울러닝코스,서울 봄 러닝 코스 추천 5 - 마이 웰니스 로그로 나만의 러닝... ,"❺ 남산 순환 + 한강 연계 코스 상급 러닝 코스, 10km, 업힐 포함, 장거리 대비 훈련 *출처: 서울특별시 내 손안에 서울 서울 러닝 코스 중 고도감이 가장 뚜렷한 루트예요. 남산 정상에서 내려다보는 봄 서울 뷰는... ",https://blog.naver.com/indigo_store/224253249340,"마이,웰니스,로그,남산,순환,한강,상급,업힐,포함,장거리,대비,출처,서울특별시,손안,도감,가장,루트,남산,정상,인디고"
서울러닝코스,[서울 러닝코스 추천 6탄]경희대학교 업힐런 러닝 후기,정릉천-성북천 https://m.blog.naver.com/gunbbang930/224187444720 #경희대러닝#서울러닝 #서울러닝코스 #러닝코스 #운동 #다이어트 #행복 #뛰기 #걷기 #대학교러닝 #러너 #기안84 #행복 #사랑 #정릉천 #경희대학교 #낭만,https://blog.naver.com/gunbbang930/224203215517,"경희대학교,업힐런,후기,정릉천,성북천,채피,니스,세상,네이버,블로그"
서울러닝코스,"서울 러닝코스 추천 (서울숲, 뚝섬한강, 반포 등)",다음주는 속초룰 달려볼게요! 공감/댓글은 컨텐츠 제작에 힘이 됩니다. 감사해요 #서울러닝코스 #남산러닝코스 #반포러닝 #한강러닝 #서울숲러닝 #서울숲한강 #붕어빵런,https://blog.naver.com/yellownoda/223981802252,"서울숲,뚝섬,한강,반포,다음주,속초,공감,댓글,컨텐츠,제작,네이버,블로그"
서울러닝코스,서울 러닝코스 추천 3.5km 자전거없는 남산둘레길 가는법,"길, 서울 런닝하기 좋은 곳 등 다양하게 즐길 수 있는 서울 러닝코스 추천 장소 소개해 봅니다. 서울... 코스도 서울 런닝하기 좋은 곳 중 하나로 러닝코스 추천 3.5km 구간이라 나름 뛰는 재미가 있습니다.",https://blog.naver.com/oisuloi/224045210314,"자전거,남산,둘레길,런닝,장소,소개,런닝,하나로,나름,재미,네이버,블로그"
서울러닝코스,서울 러닝 코스 장소 5km 달리기 옥수나들목 가는 법 짐 보관 팁,"오늘은 옥수나들목까지 가는 법부터, 5km 달리기 코스, 짐 보관 꿀팁까지 한 번에 정리해 드릴게요... 바로 서울 사는 재미구나’ 싶더라고요. 특히 잠수교는 서울 러닝 코스 명소로도 유명해서 많은 러닝... ",https://blog.naver.com/sinnyarea/224059427977,"장소,옥수,나들목,보관,옥수,나들목,보관,꿀팁,정리,바로,재미,구나,잠수교,명소,사계절,아웃도어,안내서,네이버,블로그"
서울러닝코스,서울 러닝코스 추천 사당역부터 예술의전당까지,서울 러닝 코스로 사당역 예술의전당 코스에서 얼마 없는 평지코스다. 잠깐이지만 몸이 회복되는 구간이다. 오랜만에 보는 서울 둘레길 팻말. 작년에 둘레길 다 돌고 벌써 1년이 돼버렸다. 잠깐의 평지 길을... ,https://blog.naver.com/1manbo/224061568919,"사당역,예술의전당,사당역,예술의전당,얼마,평지,잠깐,회복,둘레길,팻말,작년,둘레길,벌써,잠깐,평지,에세이,네이버,블로그"
서울러닝코스,"잠실 팝업 롯데월드몰 서울 놀거리 석촌호수 러닝 코스, 무조건... ","잠실 팝업 롯데월드몰 서울 놀거리 석촌호수 러닝 코스, 무조건 달려가세요! 글 · 사진 | 모리송 요즘 날씨가 부쩍 따뜻해지면서 가벼운 옷차림으로 마라톤이나 러닝 뛰러 나가시는 분들 정말 많으시죠? 마침... ",https://blog.naver.com/who_u_who/224254668120,"잠실,팝업,롯데,월드,석촌호수,무조건,잠실,팝업,롯데,월드,석촌호수,무조건,사진,모리,요즘,부쩍,옷차림,나가시,정말,마침"
서울러닝코스,서울 러닝코스 댕댕런 강아지런 코스 지도 gpx 8.7km 완주,왕크왕귀 댕댕이와 함께 서울 러닝코스 강아지런 코스 지도를 따라서 산책을 하고 왔어요! 저는 아래와... 강아지런 코스 시간으로 러닝을 감안하자면... 초보자는 1시간 좀 넘게 걸릴거 같구요~ 러닝을 좀... ,https://blog.naver.com/goldendaebak/224134628217,"댕댕,강아지,지도,완주,왕귀,댕댕,강아지,지도,따라서,산책,아래,강아지,감안,초보자,네이버,블로그"
서울러닝코스,제11회 서울 트레일런 마라톤 대회 정보 트레일러닝 코스... ,"서울 트레일러닝 대회 코스 109K (울트라 코스) 출발 일시: 2026년 4월 17일(금) 16:00 참가비: 280,000원 특징: 서울의 주요 산줄기를 모두 연결하는 이번 대회의 정점입니다. 무박 2일간의 사투를 통해 자신의... ",https://blog.naver.com/a135k/224251319634,"트레일,대회,정보,트레일,트레일,대회,울트라,출발,일시,참가,특징,주요,산줄기,모두,대회,정점,무박,사투,통해,자신"
서울러닝코스,서울 벚꽃런 몽마르뜨공원 러닝 코스,없이 마라톤을 할 수 있음 관심 있는 분들은 뛰뛰ㄱㄱㄱ  기간: 3월 21일 ~ 4월 30일  참가비: 3만원  코스: 4.5km / 9.5km 선택 가능 #서울벚꽃 #벚꽃러닝 #서리풀공원 #몽마르뜨공원 #벚꽃런 #서울러닝코스 #랭킹마라톤,https://blog.naver.com/ddmjk/224256284744,"벚꽃,몽마,르뜨,관심,기간,참가,선택,가능,재미,네이버,블로그"
서울러닝코스,서울 마포구 상암 하늘공원·노을공원 추천 러닝 코스 후기,러닝이 아니라 힐링 그 자체…  다음에는 시계반대방향으로도 한번 달려보고 싶네요 ^^ #상암러닝 #하늘공원러닝 #노을공원러닝 #상암러닝코스 #서울러닝코스 #마포러닝 #러닝성지 #도심러닝 #일몰러닝 #서울러닝... ,https://blog.naver.com/yeepi01/224077996644,"마포구,상암,하늘,노을,후기,힐링,자체,다음,시계,한번,보고,스노보드,자덕,네이버,블로그"
서울러닝코스,제23회 동계국제마라톤대회 서울 마라톤 일정 러닝 코스 풀... ,"제23회 동계국제마라톤대회 서울 마라톤 일정 러닝 코스 풀 하프마라톤 10km 5km 달리기 겨울 러닝 시즌을 상징하는 대회는 많지 않습니다. 차가운 공기와 단단한 노면, 그리고 페이스 관리가 더 중요해지는... ",https://blog.naver.com/qhadldhaus98/224148396201,"동계,국제,대회,일정,동계,국제,대회,일정,하프마라톤,겨울,시즌,상징,대회,공기,노면,관리,골프,여행가,축구,보미"
서울러닝코스,서울에서 뛰기 좋은 야간러닝코스 (나이트런) 추천,선선한 밤바람을 맞으며 달려보는 것은 어떠신가요? #러닝 #러닝코스 #서울러닝코스 #러닝명소 #서울러닝명소 #러닝하기좋은장소 #러닝하기좋은한강 #러닝명소추천 #러닝코스추천 #서울러닝코스추천,https://blog.naver.com/haionnet2020/224233938110,"야간,나이트런,선선,밤바람,가요,하이,아이피,공식,블로그,네이버,블로그"
서울러닝코스,서울러닝코스 잠수교 5km 10km 러닝코스 공영주차장,싶더라구요 서울러닝코스를 찾아보던 중 러너들이 여름에 자주 뛰는 인스타에서 많이 본 잠수교러닝코스가 눈에 띄더라구요 잠수교 - 동호대교 (약 10km) 코스로 뛰려했으나 동작대교(약 5km) 로 뛰고 왔지만 뭐... ,https://blog.naver.com/gkdmsgkfn/224210909066,"잠수교,공영,주차장,러너,여름,자주,인스타,잠수교,잠수교,동호대교,동작대교,네이버,블로그"
서울러닝코스,[서울 러닝코스 추천 5탄]중랑천 월릉교-장안교 9km 러닝  후기,#중랑천러닝 #러너 #마라톤준비 #마라톤 #러닝 #다이어트 #중랑천 #행복 #사랑 #뛰기 #걷기 #기안84 #나혼자산다 서울 러닝 코스 추천 시리즈 1.서 울 과 기 대 https://m.blog.naver.com/gunbbang930/224170353048 2.보 라 매... ,https://blog.naver.com/gunbbang930/224195903849,"중랑천,월릉교,장안,후기,시리즈,채피,니스,세상,네이버,블로그"
서울러닝코스,서울 러닝 코스 올림픽공원 러닝 &amp; 단풍 -빵집 추천... ,오늘은 서울 러닝코스로 좋은 올림픽공원 단풍과 근처 함께 가면 좋은 베이커리 카페인 르보마리아쥬 소개해 볼게요! 올림픽공원으로 뛰는 러닝코스의 시작은 석촌호수였어요. 제가 가장 많이 뛰는곳이... ,https://blog.naver.com/bigway22/224084412055,"올림픽,단풍,빵집,올림픽,단풍,가면,베이커리,카페인,르보마리아쥬,소개,올림픽,시작,석촌호수,가장,모리,여행,네이버,블로그"
서울러닝코스,"주말 서울러닝코스, 한강 마곡나들목 ~ 가양대교 6km 러닝... ","전일 매봉산~남산 트래킹을 해서 쉴까했으나, 코스가 너무 쉬었던걸까? 타격감이 없어서 러닝을 하러... 서울식물원 제2공영주차장에 주차하고, 한강공원 마곡나들목에서 왕복 6km 정도 뛰기로 했다. 편도 3km 되는... ",https://blog.naver.com/najilong5027/223747941106,"주말,한강,마곡,나들목,가양대교,전일,매봉산,남산,트래킹,격감,식물원,주차장,주차,한강,마곡,나들목,왕복,편도,즐거움,여자"
서울러닝코스,"마곡식물원, 서울러닝코스 추천_튤립, 수선화가 예쁜 러닝코스... ",오늘은 봄날 뛰기 좋은 서울 러닝 코스를 추천해드리려고 합니당 퇴근하고 마곡식물원으로 러닝... 행복 러닝을 할 수 있어요! 요기는 수선화 밭 에서 뛰는 나 한강까지 이어지는 코스 서울식물원을 뛰는 방법은... ,https://blog.naver.com/hyeon73dc/224255514964,"마곡,식물원,튤립,수선화,봄날,퇴근,마곡,식물원,행복,요기,수선화,한강,식물원,방법,라미,쳇바퀴,네이버,블로그"
