keyword,title,description,link,nouns
서울러닝,2026 서울러닝엑스포 방문 후기 – 러닝용품 쇼핑과 이벤트 구경,공감과 댓글은 힘이 됩니다.❤️ #서울러닝엑스포 #서울러닝엑스포2026 #서울마라톤 #2026서울마라톤 #서울마라톤엑스포 #러닝엑스포 #러닝행사 #러닝박람회 #러닝이벤트 #러닝용품 #러닝양말 #러닝모자... ,https://blog.naver.com/iamfree-/224217134867,"엑스포,방문,후기,용품,쇼핑,이벤트,구경,공감,댓글,로그,일상,행복,기록,네이버,블로그"
서울러닝,동대문디자인플라자 DDP: 2026 서울 러닝 엑스포,오늘자 스포츠동아 메인에 서울러닝엑스포 기사가 있길래 봤더니 오늘부터 일요일까지 서울마라톤 개최에 앞서 러닝엑스포가 열린다는 거다! 오늘 12시부터라고 해서 점심 먹고 다녀왔다. 지하 1층에 마련된... ,https://blog.naver.com/k233572748/224215244323,"동대문,디자인,플라자,엑스포,스포츠동아,메인,엑스포,기사,일요일,개최,앞서,엑스포,점심,지하,마련,네이버,블로그"
서울러닝,서울 러닝코스 추천 가볍게 7km 조깅,진짜 푹 쉬고 밥먹고 내일은 상황봐서 쉬던가 해야지 러닝이 운동으로써 가성비가 좋은 운동인건지 잘 모르겠다 ㅋㅋㅋㅋ 타코야키 아저씨.. 참자참자.. &lt;주제&gt; 서울 러닝코스 추천 가볍게 7km 조깅 &lt;거리&gt; 7km,https://blog.naver.com/1manbo/224252425125,"조깅,진짜,내일,상황,가성,타코야키,아저씨,주제,조깅,에세이,네이버,블로그"
서울러닝,2026 서울러닝엑스포 – DDP 러닝 행사 일정 및 정보,공감과 댓글은 힘이 됩니다.❤️ #서울러닝엑스포 #서울러닝행사 #러닝엑스포 #서울마라톤 #DDP행사 #러닝이벤트 #러닝문화 #마라톤행사 #러닝정보 #서울러닝,https://blog.naver.com/iamfree-/224205790328,"엑스포,행사,일정,정보,공감,댓글,로그,일상,행복,기록,네이버,블로그"
서울러닝,"2026 서울러닝엑스포, 린클 부스에서 확인하는 지속가능 라이프","안녕하세요, 린클입니다 3월 13일부터 15까지 열리는 2026 서울러닝 엑스포에 참가합니다! 서울러닝... 자연의 선순환을 실천하는 린클과 건강한 라이프스타일을 추구하는 러닝!♂️ 서울엑스포 현장에서... ",https://blog.naver.com/hanmiflexible/224211258968,"엑스포,부스,확인,지속,가능,라이프,엑스포,참가,자연,순환,실천,라이프스타일,추구,엑스포,현장,공식,블로그,네이버,블로그"
서울러닝,서울 런트립(1) 열린송현... 세운상가 - 서순라길 10km 러닝코스,가방 맡기고 달리니 정말 좋다! #서울런 #런트립 #공박위크 #슬로우러닝 #부상없이달리기 #seoultour #runtrip #zone2 #lowheartratetraining #saucony #달리는건축가 #달리는건축가조한 #서울투어 #러닝코스 #서울러닝코스,https://blog.naver.com/jluke313/224093976248,"런트립,열린송현,세운상가,가방,정말,건축가,건축,철학,연구소,네이버,블로그"
서울러닝,♂️린클 in 2026 서울러닝엑스포 생생한 현장으로 RUN!!,15(일) 위치 : DDP(동대문 디자인플라자)1F A-171 2026 서울러닝엑스포는 국내 첫 러닝 박람회로 13일에서 15일까지 동대문디자인플라자(DDP)에서 진행됩니다. 이번 엑스포에서는 서울마라톤 공식 파트너사와... ,https://blog.naver.com/hanmiflexible/224215219926,"엑스포,현장,위치,동대문,디자인,플라자,엑스포,국내,박람회,동대문,디자인,플라자,진행,엑스포,공식,파트너,공식,블로그,네이버,블로그"
서울러닝,롯데월드몰 룰루레몬 서울 2026 러닝 커뮤니티 클럽하우스... ,기프트백 안에 서울2026 러닝 관련 스티커가 들어있었습니다. 패스트 앤 프리 스위프틀리 룰루레몬 서울 2026 러닝 팝업스토어 나만의 치어보드 만들기 러닝크루와 3월 15일 동아마라톤 참가자를 위한 응원... ,https://blog.naver.com/stculture09/224234813403,"롯데,월드,룰루,레몬,커뮤니티,클럽,하우스,기프트,관련,스티커,패스트,프리,위프,룰루,레몬,팝업,스토어,보드,만들기,크루"
서울러닝,2025 새해일출런 서울 마라톤 일정 러닝 코스 기념품,"2025 새해일출런 서울 마라톤 일정 러닝 코스 기념품 2025년의 첫날, 2025 새해일출런으로 한해를... 기념품 #안양천마라톤 #5km달리기 #10km달리기 #새해첫날 #마라톤 #러닝 #서울러닝 #마라톤참가 #러닝대회",https://blog.naver.com/qhadldhaus98/223701638231,"새해,일출,일정,기념품,새해,일출,일정,기념품,첫날,새해,일출,한해,기념품,골프,여행가,축구,보미,네이버,블로그"
서울러닝,2026년 서울 러닝 순찰대 모집 공고,2026 서울 러닝 순찰대 모집 공고 “우리 동네는 우리가 달리며 지킨다” 서울시 자치경찰위원회는 시민의 자율적인 참여를 바탕으로 러닝을 하며 방범순찰 임무를 수행하는‘서울 러닝 순찰대’를... ,https://blog.naver.com/120seoulcall/224231491515,"순찰,모집,공고,순찰,모집,공고,동네,달리,서울시,자치,경찰,위원회,시민,자율,참여,바탕,방범,순찰,임무,수행"
서울러닝,서울특별시체육회⚡️ 러너들의 성지! 2026 서울 러닝 엑스포... ,"서울마라톤의 설렘이 시작되는 곳, [2026 서울 러닝 엑스포] 내 서울특별시체육회 홍보부스에 방문해 주신 모든 분들 감사합니다!  러닝을 사랑하는 분들의 뜨거운 에너지 덕분에 엑스포 현장이 활기로 가득... ",https://blog.naver.com/seoulsportal/224219777343,"서울특별시,체육회,러너,성지,엑스포,시작,엑스포,서울특별시,체육회,홍보,부스,방문,주신,모든,사랑,에너지,덕분,엑스포,현장,활기"
러닝코스추천,"괌 러닝코스 추천(이파오비치, 사랑의절벽, Kmart)",두짓비치 리조트 - Kmart 왕복4km 투몬시내에서 Kmart까지 달리는건데 이건 러닝코스로 볼 수는 없을거같고 Kmart안가기는 아쉬워서 그냥 아침에 뛰어서 다녀왔다?는 정도 겠어요. Kmart가는 길은 이파오비치로 가는... ,https://blog.naver.com/chongmu1024/224100930425,"파오,비치,사랑,절벽,비치,리조트,왕복,투몬시내,이건,그냥,파오,비치,네이버,블로그"
러닝코스추천,제주 쇠소깍 서귀포 러닝코스 효돈구경 트멍길 추천,찍는거 원하시면 쇠소깍 러닝코스 추천해요~ ㅎ 쇠소깍이 곧 보일 것 같아 설레면서 뛰었어요 ㅎㅎㅎ 사실 용두암도 그렇고 쇠소깍도 그렇고 굳이 거길 가야해? 라고 생각했던 명소들인데 러닝코스 목적지로... ,https://blog.naver.com/bertering/224216899683,"제주,쇠소깍,서귀포,효돈,구경,트멍길,쇠소깍,쇠소깍,사실,용두암,쇠소깍,굳이,거길,명소,목적지,어나더,제이,트래블,노트,네이버"
러닝코스추천,"트레블로지 님만 조식 맛집(+수영장 호텔, 인근 러닝코스 추천)",숙소 추천두립니당 피트니스도 작지만 수영장 뷰라 뷰맛집이라는 ~ 은근 조경이랑 건축물 미감 이런것도 멋졌던 ~~ 치앙마이 러닝코스 치앙마이대학교 앙깨우저수지 서양인들에게 유명한 러닝코스... ,https://blog.naver.com/loopy0032/224144248103,"트레블,로지,조식,맛집,수영장,호텔,인근,숙소,피트니스,수영장,맛집,은근,조경,건축물,미감,치앙마이,치앙마이,대학교,저수지,서양인"
러닝코스추천,2026 서울유아차런 훈련 고양시 러닝코스 성사체육공원 추천,성사체육공원에서 매우 가까우니 추천드려봅니다. 집에 오니 도착한 2026 서울유아차런 배번호 집에... 고양시러닝코스 #고양시러닝코스추천 #성사체육공원러닝 #성사체육공원 #성사체육공원주차... ,https://blog.naver.com/enterside/224225035937,"유아차,고양시,성사,체육,체육,매우,오니,도착,유아차,번호,고양시,아빠,네이버,블로그"
러닝코스추천,러닝 초보의 수영강부터 광안리 봄 부산 벚꽃러닝 코스 추천,러닝초보의 한달기 수영강~ 광안리 방면 수영강 벚꽃러닝 코스 영감과 장기연애를 하면서 운동은 항상... 무릎만 조심해서 달리면 정말정말 누구에게나 추천하고 싶은 러닝..! 러닝화 한 개만 있으면 걍 달리면... ,https://blog.naver.com/heechulnice/224255844073,"초보,수영강,광안,부산,벚꽃,초보,달기,수영강,광안,방면,수영강,벚꽃,영감,장기,연애,항상,무릎,달리,누구,달리"
러닝코스추천,"서울 러닝코스 추천, 처음 시작하기 좋은 구간은 어디일까",오늘은 서울 러닝코스 추천해드리도록 하겠습니다.  처음 러닝을 시작할 때 어떤 코스가 부담이 적을까... 같은 코스라도 목적에 따라 평가가 달라집니다. 그래서 추천 기준도 개인차가 큽니다. 자신이 원하는... ,https://blog.naver.com/fing3rscompany/224122802761,"처음,시작,어디,처음,시작,부담,목적,평가,기준,개인,자신,핑거스,네이버,블로그"
러닝코스추천,제주공항근처 제주시 5km 러닝코스 및 러닝템 추천,완전 추천! 특히 공항 근처에서 오션 뷰 러닝을 할 수 있다는 점이 생각보다 큰 장점이었고요 ⸝⸝ʚ̴̶̷̆ ̯ʚ̴̶̷̆⸝⸝ 제주도 갈 때마다 이 코스로 뛰겨 싶을 정도로 괜찮았습니다 다들 재밌는 제주도여행... ,https://blog.naver.com/24-08-30/224229914368,"제주,공항,제주시,완전,공항,오션,장점,제주도,제주도,여행,다음,어디,네이버,블로그"
러닝코스추천,"미사호수공원 러닝 추천 코스와 주변 식당&amp;카페(위치,주차정보)",호수공원 러닝코스 추천코스1 미사호수공원 크게 한 바퀴(약 5km) 호수공원의 장점은 구불구불한 길... 추천코스2 호수공원 반바퀴 &amp; 누리공원(약 5km) 5km로 부족한 경우 한 바퀴 더 돌아도 되지만 또 다른 루트가... ,https://blog.naver.com/carenamnam/224213052333,"미사,호수,식당,카페,위치,주차,정보,호수,미사,호수,크게,바퀴,호수,장점,호수,바퀴,누리,경우,바퀴,다른"
러닝코스추천,속초 영랑호 러닝 코스 추천｜초보도 가능한 벚꽃 러닝 명소,"귀여우신 어머님들  벚꽃 시즌, 낭만 러닝 완성 벚꽃 시즌에는 호수를 끼고 낭만러닝을 즐길 수 있는 속초, 영랑호 러닝 코스 적극 추천입니다. ✔️속초, 영랑호 러닝 장점 - 초보자도 도전 가능한 편안한... ",https://blog.naver.com/gongyoga/224255259465,"속초,초보,벚꽃,명소,어머님,벚꽃,시즌,낭만,완성,벚꽃,시즌,호수,낭만,속초,적극,속초,장점,초보자,도전,네이버"
러닝코스추천,도쿄 런트립 만족도 높은 도쿄 러닝 코스 추천,"1일차 : 아자부다이힐스 도쿄 여행 1일차 아자부다이힐스 러닝을 추천드립니다. 도쿄에 시내에 도착하면... 도쿄 여행 중 좋았더니 순간들이 많았지만, 이날 러닝 코스 만족도가 높아서 만족하며 하루를 마무리할... ",https://blog.naver.com/needtime0514/224046420888,"도쿄,런트립,만족도,도쿄,아자부,힐스,도쿄,여행,아자부,힐스,도쿄,시내,도착,도쿄,여행,순간,만족도,하루,마무리,마케터"
러닝코스추천,경주 보문단지 러닝 코스 추천 : 보문호 7km,보문 러닝 코스를 찾는다면 무조건 추천이요 보문호 러닝 기록 가민포러너 265 첫 개시의 날 무게가 참 가볍고 한눈에 바로 확인되는 디스플레이 또한 너무 마음에 쏙 든다. 특히 실시간 맵은 너무 쵝오... ,https://blog.naver.com/mi_ssong/224032727083,"경주,보문,단지,보문호,보문,무조건,보문호,기록,민포,러너,개시,무게,한눈,바로,확인,디스플레이,또한,마음,실시간,쵝오"
러닝코스추천,"동천 벚꽃 개화현황(26.03.23) , 순천 러닝코스 추천",러닝 코스로 추천하는 이유 ✔ 오천그린광장 → 동천 연결 코스 ✔ 평지 위주라 초보 러너도 가능 ✔ 풍경 보면서 힐링 러닝 가능 저는 평소대로 5k 뛰었는데 바람도 선선하고 풍경이 좋아서 운동이 아니라... ,https://blog.naver.com/yangji310/224226504855,"동천,벚꽃,개화,현황,순천,이유,그린,광장,동천,연결,평지,위주,초보,러너,가능,풍경,힐링,가능,평소,바람"
러닝코스추천,태닝키티와 함께한 비치로드 사이판 러닝코스 추천❤️,사이판 러닝코스 추천 사이판에 와서 꼭 하고 싶었던 액티비티 러닝!!! 사이판에서는 실제로 크고 작은... 강사님이 추천해주신 비치로드를 달려보기로했다! 가라판에서 조금 더 내려가면 바로 바닷가 옆에서... ,https://blog.naver.com/pjjy4996/224138318098,"태닝키티,비치,로드,사이판,사이판,사이판,티비,사이판,실제,강사,비치,로드,보기,가라,조금,바로,바닷가,고구마,네이버,블로그"
러닝코스추천,성북천 산책로 서울 혼자여행 러닝코스 추천,"성북천 서울 혼자여행 산책로 러닝코스 추천 © 글 사진 | 모리송 안녕하세요 :) 전국 방방곡곡을... 서울혼자여행이나 러닝코스, 산책할 곳을 찾고 계신다면 여기는 꼭 한 번 걸어보시길 추천드릴게요! 다음에도... ",https://blog.naver.com/who_u_who/223919691513,"성북천,산책로,여행,성북천,여행,산책로,사진,모리,전국,방방곡곡,여행,산책,다음,모리,네이버,블로그"
러닝코스추천,서울 초보 러닝 코스 추천 어린이대공원 붕어빵런 5KM 달리기,붕어빵런을 마치고 나서 붕어빵을 사 먹는 것도 일종의 코스라는데 저희는 다이어터들(?)이라 패스했어요 ㅋㅋㅋ 이색적인 풍경 속에서 즐겁게 뛰고 싶은 분들에게 어린이대공원 서울 러닝 코스를 강력 추천... ,https://blog.naver.com/sinnyarea/224131004045,"초보,어린이,붕어빵,붕어빵,마치,붕어빵,일종,다이어터,패스,이색,풍경,어린이,강력,사계절,아웃도어,안내서,네이버,블로그"
러닝코스추천,호주 시드니 러닝 코스 추천! 여행준비 하면서 알아보는 러닝... ,호주 시드니 러닝 코스 추천! 여행 전 미리 알아보는 호주에서 달리기 좋은 루트 안녕하세요 여행과... #시드니러닝코스 목차 1. 본다이 비치 → 쿠지 코스탈 워크 2. 오페라하우스 → 로열 보타닉 가든 3.... ,https://blog.naver.com/octobersy/224123673753,"호주,시드니,여행,준비,호주,시드니,여행,미리,호주,루트,여행,목차,비치,오페라,하우스,로열,가든,머핀,액티브,라이프"
러닝코스추천,서초구 러닝코스 추천 예술의전당 다녀오기,서초구 러닝코스 추천 예술의전당 다녀오기 어제는 시원하게 봄비 쏟아져서 같이 시원하게 쉬어주고 4월 10일 불금 서초구 러닝코스로 오랜만에 예술의전당 다녀오기로 했다. 오우.. 오늘 날씨 재질 무엇..?... ,https://blog.naver.com/1manbo/224248245697,"서초구,예술의전당,서초구,예술의전당,어제,봄비,불금,서초구,예술의전당,오우,재질,무엇,에세이,네이버,블로그"
러닝코스추천,의정부 중랑천 러닝코스 추천,"의정부 중랑천 러닝코스 추천 드릴려고 합니다. 보통 달리기를 하시는 분들은 지역에서 물줄기, 하천을... 앞에 사람 한두명만 있어도 러닝하는데 되게 불편 하더라구요. 여튼 제가 추천 드리는 코스로 쭉쭉... ",https://blog.naver.com/cookbad/224234120976,"의정부,중랑천,의정부,중랑천,보통,지역,물줄기,하천,불편,쭉쭉,돌콩,네이버,블로그"
러닝코스추천,"인천 송도 러닝코스 추천, 한 바퀴 달리기 좋은 구간 정리",오늘은 인천 송도 러닝코스를 추천해드리겠습니다. 초보자부터 꾸준히 달리는 러너까지 활용하기 좋은... 인천 송도 러닝코스 추천은 특별한 기술이나 분석이 필요한 문제가 아닙니다. 실제로 많이 달리는... ,https://blog.naver.com/fing3rscompany/224122807356,"인천,송도,바퀴,정리,인천,송도,초보자,러너,활용,인천,송도,기술,분석,문제,실제,핑거스,네이버,블로그"
러닝코스추천,이호테우해변 근처 소품샵 도두슈퍼마켓 제주 러닝 코스 추천,그러니 마음에 드는 제품 보이면 바로 갯하시길 추천해요! 저도 제주 러닝 코스 뛰면서 쇼핑할 계획으로 트레일러닝조끼까지 입고 간 것은 안비밀! 7. 소품샵은 역시 포토존이 생명 작은 키링 하나만... ,https://blog.naver.com/allaboutcanada/224253232365,"이호,우해,소품,슈퍼마켓,제주,마음,제품,보이,바로,제주,쇼핑,계획,트레일,조끼,비밀,소품,역시,포토,생명,키링"
러닝코스추천,겨울에도 핫한! 광안리 해변이 보이는 수영구 러닝코스 추천,광안리 해변이 보이는 수영구 러닝코스 추천 요즘에는 러닝이 참 인기가 많아진 것 같습니다. 추운... 더욱 추천드리는 곳입니다. 삼익비치타운아파트 앞 러닝 코스를 지나 다음으로는 광안리해수욕장 코스로... ,https://blog.naver.com/busan_suyeong/223737906769,"겨울,광안,해변,수영구,광안,해변,수영구,요즘,인기,더욱,삼익,비치,타운,아파트,지나,다음,광안리해수욕장,수영구,공식,블로그"
러닝코스추천,하와이러닝 코스 추천,'성션의 하와이 러닝코스 추천' 1. 5km 하와이 러닝코스 와이키키 비치 - 퀸카피올라니가든... 하와이 러닝은 아침시간을 추천해요. 저는 7시 정도에 나가는걸 좋아하는데요. 길가에 사람들이 별로없는 조용한... ,https://blog.naver.com/chongmu1024/223977800379,"하와이,하와이,하와이,와이키키,비치,카피,하와이,길가,별로,네이버,블로그"
러닝코스추천,순천 러닝코스 추천... 오천그린광장 → 동천수변공원 러닝 코스,"무리하지 않아도 좋고, 지루하지도 않은 훌륭한 코스입니다. 초보 러너에게도 &quot;이정도는 달릴 수 있겠다.&quot; 자신감을 만들어 주는 루트입니다. ✔️ 이런 분들께 추천 • 러닝을 이제 막 시작한 분 • 부담 없이 20... ",https://blog.naver.com/gongyoga/224257626130,"순천,그린,광장,초보,러너,자신감,루트,이제,시작,부담,네이버,블로그"
러닝코스추천,제주 동쪽 섭지코지 러닝 왕복 4km 코스 추천 해녀의집 아침 후기,기록하다보니 러닝 다시 시작해야겟어요.. 제주 섭지코지 러닝 코스 성산 러닝코스 추천 섭지코지... 제주러닝코스 꼭 추천해봅니다 광치기해변 백기해녀의집 제주 성산 해녀의집 추천 신선하다고 후기가 좋아... ,https://blog.naver.com/roiown/224123837814,"제주,동쪽,섭지코지,왕복,해녀,후기,기록,다시,시작,제주,섭지코지,성산,섭지코지,제주,치기,해변,해녀,제주,성산,해녀"
러닝코스추천,"다낭 미케비치 러닝 코스 추천, 반미, 노포 카페, 그랩 스쿠터 복귀",많았어요 러닝 좋아하시면 미케비치 근처 호텔 추천 네스타 호텔 1층에 스벅이 있고요 다낭 시내엔... #미케비치 #미케비치러닝 #다낭러닝코스 #다낭런닝코스 #다낭운동 #베트남러닝 #미케비치반미... ,https://blog.naver.com/us7040/224244064792,"다낭,미케,비치,반미,노포,카페,스쿠터,복귀,미케,비치,호텔,네스타,호텔,스벅,다낭,시내,마늘,네이버,블로그"
러닝코스추천,천안러닝코스 추천 : 불당동 천안 종합운동장 트랙,천안러닝코스 추천 천안 불당동 종합운동장 #천안아산러닝코스 #천안러닝코스 #천안산책 날씨가... 종합운동장 보조경기장을 천안러닝코스로 추천하는 이유는 천안시민이라면 누군나 무료로 이용이 가능하기... ,https://blog.naver.com/na_harulog/224233933162,"천안,불당동,천안,종합,운동장,트랙,천안,천안,불당동,종합,운동장,종합,운동장,보조,경기장,천안,이유,천안,시민,라면"
러닝코스추천,대련 러닝 코스 / 나 홀로 대련... 끼고 가는 대련 베이길 추천,탐방을 넘어 현지인처럼 뛰어보는 즐거움이 생겼다. 이제 어느 도시를 가든지 뛰게 된다. 대련을 뛰면서 딱하나 별로라면 미세먼지는 정말 지독하다. #대련마라톤 #대련러닝코스 #대련러닝 #대련러닝코스추천,https://blog.naver.com/papa3367/224234094211,"대련,홀로,대련,대련,베이,탐방,지인,어보,즐거움,이제,도시,가든,대련,하나,별로,라면,미세먼지,정말,현장,사회"
러닝코스추천,한강공원 러닝코스 추천 일본 무릎보호대 필수 착용 이유,"야경도 멋있어서 밤에 뛰는 것도 추천! * 편의시설: 화장실, 매점, 음수대 등 편의시설이 잘 갖춰져 있어서 불편함 없이 러닝을 즐길 수 있어요. [참고 이미지: 한강공원 코스 지도] 무릎 건강, 왜 중요할까요?... ",https://blog.naver.com/roh339/224056645822,"한강,일본,무릎,보호대,필수,착용,이유,야경,편의,시설,화장실,매점,음수,편의,시설,참고,이미지,한강,지도,무릎"
러닝코스추천,서울 5KM 달리기 러닝 코스 추천 어린이대공원 붕어빵런,서울 5km 달리기 러닝 코스 어린이대공원 붕어빵런 안녕하세요! 광진구 SNS 서포터즈 산시니입니다 :) 요즘 날씨가 많이 풀리면서 러닝 하기 딱 좋아졌는데요~ 오늘은 서울에서 가볍게 뛰기 좋은 5km 달리기... ,https://blog.naver.com/sinnyarea/224199498633,"어린이,붕어빵,어린이,붕어빵,광진구,서포터즈,산시,요즘,사계절,아웃도어,안내서,네이버,블로그"
러닝코스추천,비앙쿠르 출발 센느강 러닝 따라 에펠탑 일출 러닝 코스 추천,"강력하게 추천하고 싶다. 파리 러닝코스 추천 만약 본인의 숙소가 시내 중심가에 있거나, 에펠탑 코스 말고 다른 뷰를 즐기며 뛰어보고 싶다면 파리 시내 곳곳에 위치한 유명한 공원들도 훌륭한 러닝 스팟이... ",https://blog.naver.com/grapefruit--/224254694892,"비앙쿠르,출발,센느강,에펠탑,일출,파리,만약,본인,숙소,시내,중심,에펠탑,다른,보고,파리,시내,곳곳,위치,스팟,덕질"
러닝코스추천,"[경남/양산]뛰기 좋은 곳, 양산천 10km 러닝코스 추천",러닝을 좋아하시는 분들이라면 조용히 풍경을 즐기며 달릴 수 있는 양산천 코스를 한 번쯤 달려보시기를 추천드립니다. 양산천 10km 러닝코스 단감 테마공원 ✅주소: 경상남도 양산시 물금읍 가촌리 1279-11,https://blog.naver.com/gnfeel/224223653541,"경남,양산,양산천,풍경,양산천,보시,양산천,단감,테마,주소,경상남도,양산시,물금읍,촌리,경상남도,공식,블로그,네이버,블로그"
러닝코스추천,서울 트레일러닝 코스 추천 BEST 7: 입문부터 서울트레일런... ,서울 트레일러닝 코스 추천 BEST 7: 입문부터 서울트레일런 대회 준비까지 난이도별 완벽 정리! 산과... 트레일러닝 추천 코스를 난이도별로 정리해 드립니다!  입문 및 초보자 추천: 부담 없는 힐링 숲길... ,https://blog.naver.com/ohayo11/224192536824,"트레일,입문,트레일,트레일,입문,트레일,대회,준비,난이도,완벽,정리,트레일,난이도,별로,정리,입문,초보자,부담,힐링,숲길"
러닝코스추천,서울 러닝코스 추천 (남산공원•위례호수공원 +포천산정호수),러닝화•러닝밸트만 있으면 되니까  사서 잘 쓰구 있는 카르닉 러닝벨트도 함께 추천하구 갑니당 ⬇️⬇️⬇️⬇️⬇️ #러닝코스 #서울러닝코스 #러닝코스추천 #서울러닝코스추천 #러닝벨트추천 #러닝벨트,https://blog.naver.com/dmsal217/224065126599,"남산,위례,호수,포천,산정호수,러닝밸트,사서,카르,벨트,네이버,블로그"
러닝코스추천,"제주여행 러닝, 산책하기 좋은 코스 추천드려요","걸어보지는 못했지만, 시간 여유가 있는 분들이라면 천천히 둘러보기에 괜찮을 것 같아요~ 다음에는 이 코스까지 포함해서 좀 더 여유롭게 걸어보고 싶네요! 지금까지 제주여행 러닝, 산채코스 추천 후기였습니다.",https://blog.naver.com/art_cream/224248305108,"제주,여행,산책,보지,여유,둘러보기,다음,포함,보고,지금,제주,여행,산채,후기,꼬물이,개그,네이버,블로그"
러닝코스추천,치앙마이 러닝코스 추천 | 타패게이트 중심 올드타운 6km 러닝... ,"완성샷 먼저(뿌듯) 요 나이키런 그림 그리는 맛도 있어서, 많이들 도전하시는 코스인데 이번에 저도 해보았습니다! 새벽시간 추천: 6시~8시사이(3월 러닝기준) -가장 선선하고, 시차가 한국과 2시간 차이로... ",https://blog.naver.com/jihit/224214462874,"치앙마이,게이트,중심,드타,완성,먼저,뿌듯,나이키,그림,도전,새벽,기준,가장,선선,시차,한국,차이,일상,여행,기록"
