keyword,title,description,link,nouns
서울러닝코스,4월 러닝 기록 - 성동구 중랑천 4km 러닝코스 (성수대교 왕복... ,보기 #초보러닝 #중랑천러닝 #성수대교러닝 #응봉동러닝 #서울러닝코스 #4월러닝 #운동기록 #아침러닝 #중랑천산책 #건강습관 #러닝기록 #성동구중랑천러닝코스 #응봉체육공원 #중랑천놀빛광장 #용비쉼터... ,https://blog.naver.com/iamfree-/224253626428,"기록,성동구,중랑천,성수대교,왕복,보기,로그,일상,행복,기록,네이버,블로그"
서울러닝코스,서울 가을 초급·중급·고급 러닝코스 추천 (Feat. 달리기 매너... ,#러닝 #러닝코스 #서울러닝 #러닝크루 #러닝동호회 #동호회 #코스추천 #코스 #서울 #서울러닝코스 #남산 #남산러닝 #남산북측순환로 #서서울호수공원 #잡수교 #한강 #한강공원 #잠실 #잠실한강공원 #나이트런... ,https://blog.naver.com/pac3083/224005260785,"가을,고급,매너,언론,중재,위원회,블로그,네이버,블로그"
서울러닝코스,[서울 러닝 코스] 마곡 식물원 → 한강나들목 코스(5km),없어 따릉이 타고 복귀 주말 러닝 코스로 아주 맘에 들었다 컨디션 좋은 날에 10km 뛰어봐도 좋을듯 러닝 끝나고 마시는 오늘의 첫 코히 얼마나 꿀맛이던지 날도 풀렸으니 서울 이곳저곳 다니면서 즐겨야겠어요,https://blog.naver.com/ju_hyun1031/224225657710,"마곡,식물원,한강,나들목,따릉,타고,복귀,주말,아주,컨디션,얼마나,꿀맛,네이버,블로그"
서울러닝코스,[서울 러닝 코스] 용왕산 근린공원 러닝 트랙... ,오늘 소개할 서울 러닝 코스는 바로 &lt;용왕산 근린공원 러닝 트랙&gt;입니다. 줄여서 &lt;용왕산 트랙&gt;이라고도... 코스입니다. 스카이워크와 용왕정을 함께 이용할 수 있어 러닝과 산책을 동시에 즐길 수 있는 서울... ,https://blog.naver.com/pila_writer/224257087495,"용왕산,트랙,소개,바로,용왕산,트랙,용왕산,트랙,스카이,용왕,이용,산책,동시,무보,노트,필라테스,네이버,블로그"
서울러닝코스,한강 러닝 여행. 서울 야경 잠실한강공원 - 잠실철교 코스... ,잠실한강러닝코스 #잠실대교러닝 #러닝여행 #서울러닝여행 #서울러닝코스추천 #서울러닝코스 #여름한강러닝 #서울여행 #국내여행 #러닝여행 #야경여행 #잠실한강공원 #잠실한강공원주차장 #잠실철교야경... ,https://blog.naver.com/habibi__/223535360661,"한강,여행,야경,잠실,한강,잠실철교,잠실,한강,엄마,리뷰,일상,네이버,블로그"
서울러닝코스,서울 여의도 고구마러닝 코스 8km 뛰어보기,서울 여의도 고구마러닝 코스 8km 뛰어보기 4월 12일(일요일) 날씨가 좋아서 오늘의 러닝은! 어제도 쉰겸해서 서울 여의고 고구마러닝 코스를 다녀오기로 했다. 고구마런은 8km 가는데까지 왕복으로 7km 총... ,https://blog.naver.com/1manbo/224249756787,"여의도,고구마,보기,여의도,고구마,보기,일요일,어제,여의고,고구마,고구마,왕복,에세이,네이버,블로그"
서울러닝코스,서울 러닝코스 추천... 용산 장교숙소5단지 - 잠수교 왕복코스,그러다보니 이렇게 이벤트성으로 러닝코스를 여기저기 찾아서 뛰는 것도 너무 재미가 있네요~ 혹 러닝하시는 이웃님들 계시면 서울 러닝코스 추천 좀 해 주시겠어요?^^ 서울 러닝코스 추천 저 손뜨개도... ,https://blog.naver.com/badalaik/224244361793,"용산,장교,숙소,단지,잠수교,왕복,이벤트,여기저기,재미,이웃,계시,개도,라이프스타일,시즌,네이버,블로그"
서울러닝,"페더 서울 러닝 양말, 형광 포인트가 눈에 띄는 초경량 컴포트... ","페더 서울 러닝 양말, 형광 포인트가 눈에 띄는 초경량 컴포트 양말 후기 형광 포인트와 남산 타워, 기대... 않으면서도 러닝할 때 괜히 서울 한복판을 달리는 기분을 조금 더 살려줘서 마음에 들었어요. 마라톤... ",https://blog.naver.com/kk12129/224217208690,"페더,양말,형광,포인트,경량,포트,페더,양말,형광,포인트,경량,포트,양말,후기,형광,포인트,남산,타워,기대,복판"
서울러닝,7979 서울러닝크루 시티런 - 예쁜 돌담길 옆을 달려요!,7979 SRC 서울러닝크루 ( 7979 Seoul Running Crew) 서울시에서 무료로 매년 열리는 무료러닝크루 7979SRC(서울러닝크루) 1회차 다녀왔어요 매주 목요일 무료로 열리는 서울시 러닝크루인 7979서울러닝크루가 4월16일... ,https://blog.naver.com/ipalm/224255526930,"크루,시티,돌담,크루,서울시,무료,매년,무료,크루,크루,목요일,무료,서울시,크루,크루,네이버,블로그"
서울러닝,2026 포켓몬런 신청 서울 러닝 마라톤 접수 예매 티켓팅 방법,"2026 포켓몬런 신청 서울 러닝 마라톤 접수 예매 티켓팅 방법 저는 평소에 달리기를 즐기는 편인데, 작년 봄부터 본격적으로 러닝 대회에 관심을 갖기 시작했습니다. 그러다 주변 지인에게 포켓몬런 이야기를... ",https://blog.naver.com/designsoho94/224201362523,"포켓몬,신청,접수,예매,티켓팅,방법,포켓몬,신청,접수,예매,티켓팅,방법,평소,작년,본격,대회,관심,시작,지인,포켓몬"
서울러닝,2026 서울 러닝 엑스포: 26년 서울마라톤! DDP! 현장 등록 무료... ,"오늘은 DDP에서 열린 &lt;2026 서울 러닝 엑스포&gt;에 대해 포스팅하겠습니다. 3월 15일(일) 2026 서울마라톤이... 러닝웨어가 아닌 일반 티셔츠, 에코백에도 서울마라톤과 관련한 그림을 넣어 판매하기도 했어요.... ",https://blog.naver.com/sjn1203/224217440543,"엑스포,현장,등록,무료,엑스포,대해,포스팅,웨어,일반,티셔츠,에코,관련,그림,판매,나미,관심,사고,생활,네이버,블로그"
서울러닝,2026 포켓몬런 신청 서울 러닝 마라톤 접수 예매 티켓팅 방법... ,"2026 포켓몬런은 서울 뚝섬 한강공원에서 열리는 공식 포켓몬 러닝 이벤트입니다. IP는 The Pokemon Company가 보유하고 있고, 국내에서는 협력사를 통해 운영되는 형태입니다. 장소는 뚝섬한강공원 수변무대... ",https://blog.naver.com/openmind200/224201320560,"포켓몬,신청,접수,예매,티켓팅,방법,포켓몬,뚝섬,한강,공식,포켓몬,이벤,보유,국내,협력,통해,운영,형태,장소,뚝섬"
서울러닝,2026 포켓몬런 티켓팅 신청 예매 방법 서울 러닝 잉어킹... ,글: 끌림 사진출처 : 포켓몬런 홈페이지 #포켓몬런 #서울 #포켓몬런2026 #포켓몬런신청 #포켓몬런러닝 #포켓몬런예매 #마라톤 #서울마라톤 #서울러닝 #마라톤대회 #러닝대회 #잉어킹마라톤,https://blog.naver.com/jini4998/224202408668,"포켓몬,티켓팅,신청,예매,방법,잉어킹,사진,출처,포켓몬,홈페이지,네이버,블로그"
서울러닝,"서울 러닝코스 추천, 처음 시작하기 좋은 구간은 어디일까","서울은 강변과 공원, 도심 산책로가 잘 연결되어 있습니다. 목적에 따라 선택지가 다양합니다. 이 점이 러닝을 꾸준히 이어가기 좋은 이유가 됩니다. 오늘은 서울 러닝코스 추천해드리도록 하겠습니다.  처음... ",https://blog.naver.com/fing3rscompany/224122802761,"처음,시작,어디,강변,도심,산책로,연결,목적,선택,이유,처음,핑거스,네이버,블로그"
서울러닝,서울식물원 튤립런 초보 러너 3km 러닝 후기 +)주차 꿀팁,초보 러너의 서울식물원 튤립런 4월 튤립 개화 현황 + 주차 꿀팁 주말을 맞이하야 쌓인 스트레스도 풀겸 마곡나루에 위치한 서울식물원 러닝에 도전하고 왔어요 작년 가을쯤 개노답자매님 따라 한 번 뛰어본... ,https://blog.naver.com/rkgml548/224242665880,"식물원,튤립,초보,러너,후기,주차,꿀팁,초보,러너,식물원,튤립,튤립,개화,현황,주차,꿀팁,주말,맞이,하야,스트레스"
서울러닝,2026 서울 하프 마라톤 일정 러닝 코스 하프 10km 달리기,#서울하프마라톤 #2026서울하프마라톤 #서울러닝 #하프마라톤 #러닝대회 #마라톤코스 #러닝정보 #러닝대회추천 #서울마라톤 #광화문출발 #상암피니시 #여의도10km #러닝준비 #러닝코스 #러너일상... ,https://blog.naver.com/qhadldhaus98/224258685947,"하프,일정,하프,골프,여행가,축구,보미,네이버,블로그"
서울러닝,기록 단축을 위한서울 러닝훈련 장소 BEST 5,기록 단축을 위한 서울 러닝훈련 장소 BEST 5 마라톤 기록 단축의 비밀 훈련 코스에 있습니다 달리기... “서울 업힐 러닝의 정석으로 불리는 코스입니다.” 2. 부상 없이 안정적인 리커버리 조깅 서울숲 외곽 코스... ,https://blog.naver.com/beneficial-beom/224254216045,"기록,단축,장소,기록,단축,장소,기록,단축,비밀,업힐,정석,부상,안정,리커버리,조깅,서울숲,외곽,건강,파트너,네이버"
서울러닝,2026 KB스타런 마라톤 대회 참가 신청 10km 서울 러닝대회... ,:) [같이 보면 좋을만한 글] #5월러닝대회 #5월마라톤대회 #10km마라톤대회 #KB스타런 #서울마라톤대회 #여의도러닝 #러닝대회추천 #마라톤입문 #10km러닝 #러닝준비 #마라톤참가신청 #러닝취미 #마라톤대회참가,https://blog.naver.com/vnfma0726/224231539865,"스타,대회,참가,신청,대회,뚜웅푸,네이버,블로그"
서울러닝,2017 봄 서울 러닝기록 꿀팁,"마지막으로, 2017 봄 서울 러닝기록 꿀팁을 활용하면서 서울의 다양한 러닝 코스를 경험하고 기록을 관리하는 즐거움을 느꼈어요. 무난하면서도 체계적인 접근이 운동 동기 유지에 도움이 되었고, 앞으로도... ",https://blog.naver.com/e7w41ogk9upm/224259404109,"기록,꿀팁,마지막,기록,꿀팁,활용,경험,기록,관리,즐거움,무난,체계,접근,동기,유지,도움,사진,연습,네이버,블로그"
서울러닝,서울 송파 러닝 코스 빵런! - 문정 플루엣 &amp; 룰루 베이글,서울 송파 러닝 코스 빵런! 플루엣 &amp; 룰루베이글 2025년 가장 열심히 했던거 중에 하나가 바로... #서울러닝 #송파러닝 #플루엣송파본점 #룰루베이글 #문정동베이커피 #송파빵집 #빵런 #서울러닝코스,https://blog.naver.com/bigway22/224131445215,"송파,빵런,문정,플루,룰루,베이글,송파,빵런,플루,룰루,베이글,가장,하나,바로,모리,여행,네이버,블로그"
서울러닝,포켓몬런 신청 서울 러닝 마라톤 접수 방법,있다면 접수 일정 공지를 미리 확인하고 사전 준비를 해두는 것이 좋습니다. #포켓몬런 #포켓몬런신청 #포켓몬런서울 #포켓몬마라톤 #서울러닝대회 #서울마라톤 #러닝이벤트 #마라톤신청 #러닝대회 #포켓몬행사,https://blog.naver.com/honeyposting/224207302650,"포켓몬,신청,접수,방법,접수,일정,공지,미리,확인,사전,준비,자고,모든,순간,네이버,블로그"
서울러닝,[5일차] &quot;러닝무릎통증&quot; 예방하는 회복 러닝? 서울 5km 벚꽃... ,회복 러닝을 하며 자세를 교정하기에 서울 내에서 이만한 연습실이 또 있을까 싶습니다. 다만... 운동화끈묶는법 #서울러닝코스 #벚꽃러닝코스 #성내천러닝 #올림픽공원러닝 #송파러닝 #2주챌린지... ,https://blog.naver.com/dee7781/224241958154,"무릎,통증,예방,회복,벚꽃,회복,자세,교정,이만,연습실,다만,화끈,블로그,네이버,블로그"
서울러닝,서울마라톤일정 동아마라톤 동마 서울러닝엑스포 정보,업힐이 거의 없는 평지코스이고 날씨가 러닝하기 좋은 계절이라 개인최고기록을 세우기 좋은... 서울마라톤 서울러닝엑스포 정보 해외마라톤대회를 시작으로 뒤늦게 국내 마라톤대회에 참가한 저에게는... ,https://blog.naver.com/allaboutcanada/224212672345,"일정,동아마라톤,엑스포,정보,업힐,거의,평지,계절,개인,최고,기록,엑스포,정보,해외,대회,시작,국내,대회,참가,제스"
서울러닝,서울 초보 러닝 코스 추천 어린이대공원 붕어빵런 5KM 달리기,오늘 소개해 드릴 곳은 서울 러닝 코스 중 초보자들이 뛰기 좋은 '어린이대공원'을 소개해 드리려고 합니다! :) 완주하면 붕어빵 모양으로 뛸 수 있어서 '붕어빵런'으로도 유명해요! [서울 초보 러닝 코스... ,https://blog.naver.com/sinnyarea/224131004045,"초보,어린이,붕어빵,소개,드릴,초보자,어린이,소개,완주,붕어빵,모양,붕어빵,초보,사계절,아웃도어,안내서,네이버,블로그"
서울러닝,7979 서울 러닝크루 모집 수준별 야간 러닝 코스 정보,서울시에서는 러닝을 처음 시작하는 초보자부터 숙련된 러너까지 누구나 서울의 아름다운 야간 명소를 만끽하며 달릴 수 있는 7979 서울 러닝크루 프로그램을 운영합니다. 전문적인 지도와 체계적인 러닝... ,https://blog.naver.com/dysnomia/224256209216,"크루,모집,수준별,야간,정보,서울시,처음,시작,초보자,숙련,러너,누구,야간,명소,만끽,크루,프로그램,운영,전문,지도"
서울러닝,서울러닝엑스포 DDP 라인프렌즈X아디다스키즈런 후기,"키즈런은 3월14일 종료되었지만 서울러닝엑스포는 15일 일요일까지 DDP전관에서 관람하실 수 있고, 서울마라톤도 열리기에 러닝에 관심 있으시다면 DDP로 오실 준비하세요. 아이와 러닝 자체가 처음이라... ",https://blog.naver.com/babyloshon/224216586337,"엑스포,라인,프렌즈,아디다스,키즈,후기,키즈런,종료,엑스포,일요일,전관,관람,관심,준비,아이,자체,처음,길동,네이버,블로그"
서울러닝,러닝필수템 몽베스트 생수와 함께한 10K챌린지 서울 마라톤 후기,꾸준한 수분 관리로 컨디션 잘 챙기면서 즐거운 러닝 라이브 즐기시길 응원합니다 :)✨✨✨ #10k챌린지 #몽베스트 #몽베스트생수 #몽베스트미네랄워터 #서울10k챌린지 #10k챌린지서울 #러닝 #마라톤 #러닝템... ,https://blog.naver.com/luvddang9/224060429431,"필수,베스트,생수,린지,후기,수분,관리,컨디션,라이브,응원,에이미,네이버,블로그"
서울러닝,서울 힐링 러닝 코스! 한양도성길 트레일 러닝 후기,이번 러닝은 서울역에서 시작했습니다. 장거리 코스이다 보니 짐이 꽤 있었는데 서울역 짐 보관함을... 한양도성길은 단순히 서울 러닝 코스라고 생각하고 접근하면 생각보다 훨씬 힘들게 느껴질 수 있습니다.... ,https://blog.naver.com/sjsg0079/224257365254,"힐링,한양도성,트레일,후기,서울역,시작,장거리,서울역,보관,한양도성,접근,일상,여행,여행,네이버,블로그"
서울러닝,2026 더레이스 서울 21K... 하프마라톤 10km달리기 러닝 코스,https://theraceseoul21k.com/ #더레이스서울21K #서울하프마라톤 #서울10km #광화문마라톤 #서울러닝대회 #하프마라톤접수 #서울러닝 #도심러닝 #2026마라톤 #러너일정 #마라톤추가접수 #서울레이스... ,https://blog.naver.com/qhadldhaus98/224199727829,"레이스,하프마라톤,골프,여행가,축구,보미,네이버,블로그"
서울러닝,2026 지구런 접수 서울 마라톤 일정 5km 10km 달리기 러닝 대회,없이 러닝하는 사람들이 자연스럽게 보이죠. 서울 마라톤 일정도 점점 다양해지고 선택할 수 있는... 한강과 도심을 함께 볼 수 있는 서울 러닝 코스라서 풍경도 좋고요. ✔️ 자전거길과 산책로 혼용... ,https://blog.naver.com/00dkfmal/224244320637,"지구,접수,일정,대회,자연,보이,일정,점점,선택,한강,도심,풍경,자전거,산책로,혼용,라라,네이버,블로그"
서울러닝,서울마라톤 일정부터 러닝 엑스포 이벤트까지 총정리,"&quot;정말 얇다&quot; 잠스트 러닝 무릎보호대, 서울 러닝엑스포에서 가장 저렴하게! 서울마라톤 일정이 가까워지면서 러닝 준비를 다시 점검하게 됐다. 날씨가 따뜻해지니, 가까운 하천 길에서 러닝 하는 사람들이... ",https://blog.naver.com/dalliza88/224205600449,"일정,엑스포,이벤트,정리,정말,잠스트,무릎,보호대,엑스포,가장,일정,준비,다시,점검,하천,꼴찌,러너,아웃도어,트렌트,리포트"
서울러닝,"일기 | 니부마롱, 버터떡, 더현대서울, 러닝, 용산, 한남동, 합정",나도 조금 얌전히 걸어볼게요  여의도 간 김에 #더현대서울 들러서 #sie시에 신상 입어봤는데 이... 상태로 #러닝 까지 했더니 거의 이만 보 찍혀있어서 뿌듯했는데...! 이날 뭔가 뛰기 싫었거든요  그래도 해야지... ,https://blog.naver.com/parkseyo_/224217857109,"일기,부마,버터,현대,용산,한남동,합정,조금,여의도,신상,상태,거의,뭔가,세영,네이버,블로그"
서울러닝,서울 걷기 좋은 길! 양재천 러닝 &amp; 자전거 타기 &amp; 수영장 안내,봄부터 여름 시즌에는 다양한 꽃들이 많아 더욱 아름답습니다~ 그럼 모두들 건강 유의하시고 좋은 하루 보내세요:) #양재천 #서울걷기좋은길 #서울자전거 #서울러닝 #양재천자전거 #양재천러닝 #영동1교... ,https://blog.naver.com/bigway22/223885566870,"걷기,양재천,자전거,수영장,안내,여름,시즌,꽃들이,더욱,모두,건강,유의,하루,모리,여행,네이버,블로그"
서울러닝,러닝 무릎보호대 득템! 러닝엑스포 × 서울마라톤 일정,내게 맞는 러닝 무릎보호대를 역대급 혜택으로 만날 수 있는 기회! 서울러닝엑스포에 2026 서울마라톤 공식 스폰서인 잠스트가 출격합니다. 행사 장소: 동대문디자인플라자 전관 (관람비 무료) 전시 기간... ,https://blog.naver.com/nicenet/224204943943,"무릎,보호대,득템,엑스포,일정,무릎,보호대,역대,혜택,만날,기회,엑스포,공식,스폰서,잠스트,출격,행사,장소,동대문,디자인"
서울러닝,러닝 양말 추천 컴포트 페더 서울 아킬레스 앵클쉴드 러닝 후기,"간략히 두 제품을 설명하자면, 페더 서울: 데일리 러닝에 부담 없는 밸런스형. 얇고 통기성이 좋다. 심리스 공법 적용 아킬레스 앵클쉴드: 뒤꿈치·아킬레스 보호 체감 확실. 두껍고 쿠션이 훨씬 좋다. 단... ",https://blog.naver.com/review_ocer/224257028002,"양말,포트,페더,아킬레스,쉴드,후기,제품,설명,페더,일리,부담,밸런스,기성,리스,공법,적용,아킬레스,쉴드,뒤꿈치,아킬레스"
서울러닝,2026 서울 러닝 엑스포 첫 개최 참관 후기,"2026 서울 러닝 엑스포 러너들의 축제 러닝 엑스포에 다녀왔다. 서울 동아마라톤 대회 전 DDP에서 열린 이 행사에는 후원서 아디다스의 스포츠 용품, 러닝웨오 영양식, 러닝 장비와 제품 등을 한자리에서 만나볼... ",https://blog.naver.com/knydiary/224219851194,"엑스포,개최,참관,후기,엑스포,러너,축제,엑스포,동아마라톤,대회,행사,후원,아디다스,스포츠,용품,웨오,영양식,장비,제품,한자리"
서울러닝,서울 5KM 달리기 러닝 코스 추천 어린이대공원 붕어빵런,서울 5km 달리기 러닝 코스 어린이대공원 붕어빵런 안녕하세요! 광진구 SNS 서포터즈 산시니입니다... 이색적인 서울 러닝 코스 꼭 코스를 고정하지 않고 귀여운 동물 친구들이 있는 동물원을 가로질러 뛰거나... ,https://blog.naver.com/sinnyarea/224199498633,"어린이,붕어빵,어린이,붕어빵,광진구,서포터즈,산시,이색,고정,동물,동물원,사계절,아웃도어,안내서,네이버,블로그"
서울러닝,서울 러닝코스 추천 (남산공원•위례호수공원 +포천산정호수),서울 • 서울 근교 러닝하기 좋은 곳  첫번째는 #남산둘레길 #남산 조금 고난이도였던 곳이에요! 남산... 카르닉 러닝벨트도 함께 추천하구 갑니당 ⬇️⬇️⬇️⬇️⬇️ #러닝코스 #서울러닝코스 #러닝코스추천... ,https://blog.naver.com/dmsal217/224065126599,"남산,위례,호수,포천,산정호수,근교,조금,난이도,남산,카르,벨트,네이버,블로그"
서울러닝,[서울 러닝 코스 추천] 영상 5도~10도 러닝 옷차림 완벽... ,드린 서울의 예쁜 코스들 중 마음에 드는 곳을 골라 이번 주말 가볍게 5km부터 시작해 보는 건 어떨까요? 안전하고 즐거운 러닝 되시길 응원합니다! #영상5도러닝 #영상10도옷차림 #러닝복장추천 #서울러닝코스... ,https://blog.naver.com/yeepi01/224214350293,"영상,옷차림,완벽,마음,주말,부터,시작,응원,스노보드,자덕,네이버,블로그"
서울러닝,서울러닝엑스포 - 롯데도 나와? 카스두? 오터 브랜드 소개... ,러닝을 하지 않는 제가 러닝엑스포를 방문했습니다? 바로 행사와 박람회를 좋아하고 기업 이벤트 부스... 즐기시길~ 이번 서울 주말 나들이는 DDP 동대문디자인플라자 서울러닝엑스포도 한 번 생각해보세요☆,https://blog.naver.com/hunz157/224215768366,"엑스포,롯데,카스,브랜드,소개,엑스포,방문,바로,행사,박람회,기업,이벤트,부스,주말,나들이,동대문,디자인,플라자,엑스포,네이버"
서울러닝,2026 버킷런 마라톤 접수 일정 참가비 기념품 서울 러닝... ,일정 맞는 분들은 신청해볼 만한 대회입니다. #2026버킷런 #버킷런 #한강러닝대회 #잠실한강공원 #서울러닝 #5km달리기 #10km달리기#러닝 #러닝대회정보 #마라톤 #서울마라톤일정,https://blog.naver.com/qhadldhaus98/224135966215,"버킷,접수,일정,참가,기념품,일정,신청,대회,골프,여행가,축구,보미,네이버,블로그"
서울러닝,서울 러닝기록 잘하는법,서울 러닝기록 잘하는법 서울에서 러닝을 즐기다 보니 자연스럽게 서울 러닝기록 잘하는법에 대해 관심이 생기더라고요. 특히 도시의 다양한 코스와 계절별 변화에 맞춰 기록을 관리하는 방법을 찾는 과정에서... ,https://blog.naver.com/932h6q4b1t6d/224259397124,"기록,기록,자연,기록,대해,관심,도시,계절,변화,기록,관리,방법,과정,일러스트,공부,실파,네이버,블로그"
서울러닝,러닝 무릎보호대 잠스트 JK-BAND 추천 서울마라톤 러닝 엑스포,서울 러닝 엑스포 현장 착용+최저가 할인 기회 이렇게 제가 애용하며 사용 중인 잠스트 JK-BAND를 직접 체험해 볼 수 있는 자리가 있어요. ✔️ 3월 13일~15일 ✔️ 동대문디자인플라자 DDP ✔️ 서울마라톤 러닝... ,https://blog.naver.com/00dkfmal/224204042979,"무릎,보호대,잠스트,엑스포,엑스포,현장,착용,최저,할인,기회,애용,사용,중인,잠스트,직접,체험,자리,동대문,디자인,플라자"
서울러닝,"[서울 러닝 에세이] 매주 주말 마라톤, 이대로 괜찮을까? 점점... ","내 한 걸음이 누군가의 불편이 아니라, 서울이라는 도시와 함께 호흡하는 건강한 움직임이 되기를. 그리고 그 위에서 러너들도 오래도록 달릴 수 있기를. #서울러닝 #마라톤 #러닝문화 #잠실대교 #트레일러닝... ",https://blog.naver.com/gangsinjin/224235830469,"에세이,주말,점점,걸음,누군가,불편,도시,호흡,움직임,러너,네이버,블로그"
서울러닝,2026 서울 러닝 엑스포 방문 후기,도착해서 안내에 따라 참가자 신청 후 입장 서울마라톤 마스코트 너무 귀욥네용 아트홀로 들어가니 롯데에서 몽쉘 하나씩 나눠주시더라고요 입장하자마자 아디다스 러닝화부터 각종 용품들이 디피되어... ,https://blog.naver.com/ddomaru/224232385584,"엑스포,방문,후기,도착,안내,참가자,신청,입장,마스코트,아트,홀로,롯데,몽쉘,하나,입장,자마자,아디다스,각종,용품,디피"
서울러닝,서울 한강 러닝 코스 &amp;  한강버스 잠실선착장 테라로사 카페... ,서울 한강 러닝 코스 테라로사 카페 &amp; 한강공원 모래놀이터 요즘 러닝 하기 너무 좋은 계절인데요! 오늘은 서울 한강 러닝 코스와 러닝 후 가기 좋은 테라로사 카페 자세히 소개해 드릴게요:) 한강러닝 코스 1.... ,https://blog.naver.com/bigway22/224256698423,"한강,한강,버스,잠실,선착장,테라로사,카페,한강,테라로사,카페,한강,모래,놀이터,요즘,계절,한강,가기,테라로사,카페,소개"
서울러닝,시 무릎 통증&quot; 잡는 상체 이완법? 서울 5km 벚꽃 러닝코스 추천,특히 성내천에서 올림픽공원을 잇는 이 벚꽃 러닝코스는 서울 내에서 보기 드문 '고저 차가 적은... #러닝무릎통증 #무릎통증완화 #상체이완 #러닝자세 #달리기자세 #운동화끈묶는법 #러닝화추천 #서울러닝코스... ,https://blog.naver.com/dee7781/224238913094,"무릎,통증,상체,이완,벚꽃,성내천,올림픽,벚꽃,보기,고저,블로그,네이버,블로그"
